,created_utc,id,link_id,parent_id,body,author,date,lang_score,in_scope,terms,termlangs,useful,batch,rewire_id,trans_deepl
363,1568342564,f031ijp,t3_d3bcck,t3_d3bcck,"Gila, ni ads nya kompas super super super annoying. Mau baca berita, ga bisa ngeload sama sekali. Sekalinya selesai ngeload, ga taunya jeng jeng jeng iklan segede bagong muncul gitu aja. Yes, I know they need money, tapi mbok ya jangan gitu juga. 

Ada ga sih berita online yang bener-bener berkualitas? Yg gw tau cuman Tirto.",m4rk00s,2019-09-13,"[('indonesian', 1.0), ('malay', 0.9478995816742015), ('english', 0.8329328495432443)]",True,['bagong'],['Indonesian'],True,batch_1,rewire_singapore_363,"Crazy, these ads from Kompas are super super super super annoying. Want to read the news, can't load at all. Once it's done loading, I don't know what to do, but an ad the size of a bagong just pops up. Yes, I know they need money, but let's not do that.

Is there really quality online news? All I know is Tirto."
364,1607174128,gep2kp4,t3_k75aqt,t1_geoxd5f,"""b-belegug!""",holypika,2020-12-05,"[('malay', 1.0), ('indonesian', 0.950718352374766), ('english', 0.9365824738387413)]",True,['belegug'],['Indonesian'],True,batch_1,rewire_singapore_364,"""b-belegug!"""
365,1561137482,erq8c9o,t3_c2t3au,t3_c2t3au,"Sori ye, gue bukan tertrigger. Gue paham ada orang2 yang delusional, apapun dianggep kristenisasi lah, permufakatan melawan Islam lah, Muslim didera lah. Lo bisa hina mereka ""onta2"" segala macem mirip si Sugi bilang.

&amp;#x200B;

Boleh juga dong gue ngomong, meme lu shit &amp; trying hard untuk membayangkan kejadian yg gak bakal mungkin terjadi.",hashashin_randall,2019-06-21,"[('malay', 1.0), ('indonesian', 0.983052347617013), ('english', 0.7244635786115678)]",True,['hina'],['Indonesian'],True,batch_1,rewire_singapore_365,"Sorry, I'm not triggered. I understand there are delusional people, anything is considered Christianization lah, conspiracy against Islam lah, Muslims are persecuted lah. You can insult them as ""camels"" like Sugi said.

&amp;#x200B;

I can also say, your memes are shit and trying hard to imagine events that will never happen."
366,1595323072,fyr02j8,t3_htkl6n,t1_fyk02c3,"wah terima kasih udah berbagi ilmu, kamu kok tau banget soal asma &amp; alergi? 
saya jadi kecewa saya pecinta parfume, parfume di rumah yang rada mahal wanginya saya suka jadi gk bisa di pakek, tapi kesehatan no 1

tolong kalo untuk hobi aktifitas fisik kaya gym, joging, basket, nyanyi, main gitar, nongrong di malam hari.
 itu gimana kalo saya asma?",vans_____01,2020-07-21,"[('indonesian', 1.0), ('malay', 0.933272017479323), ('english', 0.6994759032160411)]",True,['basket'],['Singlish'],True,batch_1,rewire_singapore_366,"wow thanks for sharing your knowledge, how come you know so much about asthma &amp; allergies?
I'm so disappointed that I'm a perfume lover, the perfume at home is rather expensive the fragrance I like so I can't use it, but health is no 1.

Please if you like physical activities such as gym, jogging, basketball, singing, playing guitar, hanging out at night.
 What if I have asthma?"
367,1608804213,ggvyex6,t3_kj8l01,t1_ggvtbdg,terajangke bae la buyan sikok ni,I_AM_GODDAMN_BATMAN,2020-12-24,"[('indonesian', 1.0), ('malay', 0.9926153234897067), ('english', 0.7841705901935607)]",True,['Buyan'],['Indonesian'],True,batch_1,rewire_singapore_367,terajangke bae la buyan sikok ni
368,1645362338,hxp6gpr,t3_svmxj6,t3_svmxj6,"Ada bebek

Di atas papan

&gt;!Dapat memek!&lt;

&gt;!Lupa kawan!&lt;",iM2Lethal,2022-02-20,"[('indonesian', 1.0), ('malay', 0.9758790462924424), ('english', 0.8577880695777435)]",True,['memek'],['Indonesian'],True,batch_1,rewire_singapore_368,"There is a duck

On the board

Get some pussy!

""Forget a friend!"
369,1546398378,ed20js9,t3_abl35c,t3_abl35c,"~~Tempik~~ Tempe all the way !

Tahu itu enak kalo:
1. Tahu sumedang
2. Tahu susu
3. Tahu pabrikan yun-yi",cebong212,2019-01-02,"[('indonesian', 1.0), ('malay', 0.9292767025736811), ('english', 0.7548559455188806)]",True,['Tempik'],['Indonesian'],True,batch_1,rewire_singapore_369,"~~Tempik~~ Tempe all the way!

Tofu is delicious when:
1. Sumedang tofu
2. Milk tofu
3. Tofu manufacturer yun-yi"
370,1592039579,fuosaws,t3_h7y53o,t1_fuor98j,"Setuju. Bahkan bencong sebenarnya lebih manly, karena berani menghadapi *society*.",FukuchiChiisaia21,2020-06-13,"[('indonesian', 1.0), ('malay', 0.9261163661279418), ('english', 0.635362965425358)]",True,['bencong'],['Indonesian'],True,batch_1,rewire_singapore_370,"Agreed. Even bencong is actually more manly, because it dares to face *society*."
371,1549193571,efnhwgi,t3_amfx87,t3_amfx87,"So funny wierd story today about 'dating' 

So ceritanya kn kt dari daerah kkn (cipanas lol)pagi pagi, langsung ke jkt, skip skip ketemu ortu gw and some akward stuff skip skip ke mall, pas nyampe dia langsung ke toko makeup dan langsung beli satu set gt, ke toilet lamaaa (padahal waktu yng sama gw jg boker) and tada tb tb yng tadinya muka ngantuk dari desa langsung udh kemakeup ready keliling mall...

Me like ""Nani the fuck?"" Why... Women are wierd sometimes, mungkin 2 minggu lbh gk makeup gatel ",anrico17,2019-02-03,"[('indonesian', 1.0), ('malay', 0.959326173223556), ('english', 0.852454817749648)]",True,['gatel'],['indonesian'],True,batch_1,rewire_singapore_371,"So funny wierd story today about 'dating'

So the story is that we came from the kkn area (cipanas lol) in the morning, went straight to jkt, skip skip to meet my parents and some awkward stuff skip skip to the mall, when we arrived she went straight to the makeup shop and immediately bought a set of gt, went to the toilet for a long time (even though at the same time I was also playing) and tada tb tb who was sleepy-faced from the village immediately udh kemakeup ready to go around the mall ...

Me like ""Nani the fuck?"" Why... Women are wierd sometimes, maybe 2 weeks more without makeup itching"
372,1591953030,fukxbxi,t3_h0wqge,t1_ftr56b2,"Ok ok, aku try terangkan cara aku. Dan aku harap, kat mana pon kau berada, mohon kau sabar😅😅. Alah, manusia, biasalah tu. Sekejap lagi nanti dia pulak cari kau minta bantuan. Ok so, back to the topic

#ELI5

so, apa yang aku faham, orang tu kata kalau kau masuk group yang semua liberal, kau jugak akan dilabel ""liberal"", gitu kan?
Ok, aku akan cuba backup kau dan bagi sebab kenapa orang tu fikir gitu Or maybe else😅😅. Dan aku cuba cari benda yang aku boleh kemukakan
Ok, kita amik contoh, kau ni ustaz adam. Masuk lorong pelacuran. Tempat tu dianggap jijik dan kotor, dan kebiasaan masyarakat untuk anggap orang kat situ hina. Tapi kau, sebagai ustaz adam ada motif baik, nak cari nur atau orang orang yang nak kembali ke jalan ilahi. 
Macam kau jugak lah dalam kes ni. Kau masuk tempat yang mungkin pada sesetengah orang nampak terkutuk, tapi kalau niat kau baik, hear me out my man, insya-Allah Allah akan permudahkan segala urusan kau
Ok, ok...... Satu contoh lain. Kau pergi kilang buat minyak wangi. Kau xde pape niat pon nak beli minyak wangi. Kau cuma nak jalan jalan. Tapi setiap kali kau lalu, mesti ada orang bagi free strip untuk kau test bau. Lama lama kau tergoda jugak. Sebab yelah, minyak wangi tu sedap kot. So, kes ni,Sama gak yang mungkin akan berlaku dengan kau. Bukan aku nak kata kau akan jadi jahat. Tapi tipu helah syaitan ni licik weh. Kau memang niat nak masuk kilang minyak wangi tu, x nak beli pape, tapi last last, satu badan kau bau wangi dan kau ada jugak terbeli 1 atau 2 botol. Dalam kes kau, aku takut, syaitan akan hasut kau untuk terdorong ke jalan yang salah. Aku bukan nak doakan kau terpesong atau apa apa perkara yang buruk. harap kau x fikir cam tu. Tapi, Aku yakin, dengan niat kau tu, insya-Allah tuhan balas usaha kau. Tapi aku x mahu benda yang buruk terjadi kat kau bro.

So, kesimpulan nya...... Hehe....... Kalau kau masuk group tu, dengan sebab baik, nak cari ilmu, teruskan. Cari ilmu yang berguna. Jangan mengalah. Tapi kau kena berhati hati. Jangan terpesong dari niat asal. 
Aku harap, kat mana pon kau berada, please have a great day. Manusia memang gitu bro. Banyak ragam. insya-Allah there will be better days",MidnightWhaleX11,2020-06-12,"[('malay', 1.0), ('indonesian', 0.991456879125456), ('english', 0.7308142025282931)]",True,['hina'],['Indonesian'],True,batch_1,rewire_singapore_372,"Ok ok, I try to explain my way. And I hope, wherever you are, please be patient😅😅. Alah, man, that's normal. Soon he'll be looking for you for help. Ok so, back to the topic

#ELI5

so, from what I understand, your parents said that if you join a group that is all liberal, you will also be labeled ""liberal"", right?
Ok, I'll try to backup you and share the reason why people think that or maybe else😅😅. And I'll try to find things that I can point out.
Ok, let's take an example, you are ustaz adam. Enter a brothel. That place is considered disgusting and dirty, and it's the custom of society to consider people there despicable. But you, as ustaz adam have a good motive, to find nur or people who want to return to the divine path.
You're the same in this case. You're entering a place that may seem cursed to some people, but if your intentions are good, hear me out my man, insha-Allah Allah will facilitate all your affairs.
Ok, ok...... One other example. You go to a refinery to make perfume. You xde pape intention pon nak buy perfume. You just want to go for a walk. But every time you pass by, there must be someone giving out free strips for you to smell test. You're tempted for a long time. Because yelah, that perfume smells good. So, in this case, it's the same thing that might happen with you. I'm not saying you'll be bad. But the trickery of the devil is cunning weh. You had the intention to enter the perfume factory, x nak buy pape, but last last, one body you smell fragrant and you also bought 1 or 2 bottles. In your case, I'm afraid, the devil will incite you to go down the wrong path. I'm not praying for you to get lost or anything bad. hope you don't think that. But, I'm sure, with your intentions, Insha-Allah God will reward your efforts. But I don't want anything bad to happen to you bro.

So, in conclusion...... Hehe....... If you're in the group, for a good reason, looking for knowledge, keep going. Find useful knowledge. Don't give in. But you have to be careful. Don't get distracted from your original intention.
I hope, wherever you are, please have a great day. Humans are like that bro. Many varieties. Insha-Allah there will be better days."
373,1530675139,e1rc8ia,t3_8vx5h1,t1_e1r1ro7,"Jalan jalan ke kota kembang  
melihat gemulai gemerlap malam  
oi kampang  
gelud yuk  
",bukiya,2018-07-04,"[('malay', 1.0), ('indonesian', 0.995615291861207), ('english', 0.6600681948565298)]",True,['kampang '],['Indonesian'],True,batch_1,rewire_singapore_373,"Travel to the Flower City
see the glittering sparkle of the night
oi kampang
gelud yuk
"
374,1625209443,h3s0ydx,t3_obq823,t1_h3rx6xt,"Kalau lu good looking pertanyaan sejelek apapun pasti bakalan dijawab dengan baik2, kesannya gak creepy. Lu ngeliatin diam2 juga pastinya dibilang ""secret admirer"".

Coba kalau lu buluk/dekil/kumel, baru ndeketin, udah telpon polisi dia.",enraged_supreme_cat,2021-07-02,"[('indonesian', 1.0), ('malay', 0.945802367567932), ('english', 0.7574203679035477)]",True,['dekil'],['Indonesian'],True,batch_1,rewire_singapore_374,"If you're good looking, any bad question will be answered nicely, it's not creepy. You will also be considered a ""secret admirer"".

Try if you're ugly/dekil/kumel, new ndeketin, already call the police him."
375,1626583601,h5lh5qk,t3_omf8mr,t1_h5kxfku,"pernah diceritain sama dosen, temennya tinggal di Trenggalek dan kerjaannya remote company luar negeri. di daerahnya rumahnya paling gede terus disaranin sama dosenku suruh ternak kecil kecilan biar gk dikira ngepet wkwkwk",shandytp,2021-07-18,"[('indonesian', 1.0), ('malay', 0.9804982807685338), ('english', 0.7083764461434776)]",True,['ngepet'],['Indonesian'],True,batch_1,rewire_singapore_375,"I was once told by a lecturer that his friend lives in Trenggalek and works for a remote company abroad. in his area, his house is the biggest, so my lecturer advised me to ask for small livestock so that I wouldn't be thought of as ngepet wkwkwk."
376,1655694233,id0npwn,t3_uzsas2,t1_iadxpuu,"Biasalah,gang-gang tak pernah merasa burit.dia buat fantasi dia ada awek cun ker camtuelah.yang aku pasti gang-gang nie memang bahaya dan takleh kasi dekat dengan pompuan mcam kalu ko ada adik or kakak bahaya kalu dekat ngan bangsa nie,nanti dia ngaku tu adik or kakak dia plak 😂😂😂.",Regular-Code-7328,2022-06-20,"[('indonesian', 1.0), ('malay', 0.9601340803197701), ('english', 0.6653750578825218)]",True,['burit'],['indonesian'],True,batch_1,rewire_singapore_376,"Biasalah,gang-gang never feel burit.he make fantasy he have awek cun ker camtuelah.yang aku pasti gang-gang nie memang danger dan takleh kasi dekat dengan pompuan mcam kalu ko ada adik or kakak bahaya kalu dekat ngan bangsa nie,nanti dia ngaku tu adik or kakak dia plak 😂😂😂😂."
377,1586131371,fmjj5rk,t3_fve3xg,t3_fve3xg,bangang,budak_jahat,2020-04-06,"[('malay', 1.0), ('indonesian', 0.9766294207064485), ('english', 0.61318527229962)]",True,['bangang'],['indonesian'],True,batch_1,rewire_singapore_377,bangang
378,1610371752,givmfya,t3_kv03ir,t3_kv03ir,"terus

""selamat datang di desa toket, kami perwakilan RT mau data penduduk baru yang masuk, nama bapak siapa ya?""

""uhh... [kanjut.""](https://cdn-2.tstatic.net/tribunnews/foto/bank/images/kakek-kanjut_20170728_015038.jpg)",sebatsdulu,2021-01-11,"[('malay', 1.0), ('indonesian', 0.9991052291877529), ('english', 0.8274019298707501)]",True,['kanjut'],['indonesian'],True,batch_1,rewire_singapore_378,"continue

""welcome to toket village, we are representatives of the neighborhood association (RT) want data on new residents who entered, what is your name?""

""uhh... [continued.""](https://cdn-2.tstatic.net/tribunnews/foto/bank/images/kakek-kanjut_20170728_015038.jpg)"
379,1601982382,g7vu2fl,t3_j6296x,t3_j6296x,"""mak kau hijau!""",ireadblitz,2020-10-06,"[('malay', 1.0), ('indonesian', 0.9822878724092277), ('english', 0.7280604169493058)]",True,['Mak kau hijau!'],['Malay'],True,batch_1,rewire_singapore_379,"""You green mac!"""
380,1563691971,eucycmf,t3_cfuo6w,t1_eucvl4u,nyawa orang tolol murah kok,biglowend,2019-07-21,"[('indonesian', 1.0), ('malay', 0.9128861060777547), ('english', 0.7077364476329283)]",True,['Tolol'],['Indonesian'],True,batch_1,rewire_singapore_380,the life of a moron is cheap
381,1569472410,f1goegi,t3_d98r83,t1_f1gi3t9,nate beruk bila ada client yang nakal bagi 1hour reading untuk data 10 tahun. spreadsheet telampau besar xboleh proses pakai excel kena proses pakai matlab.,karlkry,2019-09-26,"[('malay', 1.0), ('indonesian', 0.9723987785399417), ('english', 0.7496401830619208)]",True,['nate'],['Malay'],True,batch_1,rewire_singapore_381,nate beruk if there is a naughty client for 1hour reading for 10 years data. spreadsheet is too big xboleh process using excel kena process using matlab.
382,1630143703,hanxnna,t3_pcsb30,t1_hanujs5,"Nasip jadi anak IT lah, mending belajar budek &amp; bego aja. Uda biasa la nanti diminta ""eh haxx akun si anu/satelit dong"" ""lu kan bisa bikin program, ngapain kerja ama orang, kenapa lu ga bikin sendiri aja tokped/gojek/game?"" lmao.",ularbeludak,2021-08-28,"[('indonesian', 1.0), ('malay', 0.9630525647628059), ('english', 0.7588236286892266)]",True,"['bego', 'budek']",['Indonesian'],True,batch_1,rewire_singapore_382,"It's bad to be an IT kid, it's better to learn to be dumb. Uda usual la later asked ""eh haxx account so / satellite dong"" ""you can make a program, why do not work with people, why do not you make your own tokped / gojek / game?"" lmao."
383,1525328998,dydbd5g,t3_8go8ww,t3_8go8ww,US... Israel... US this and that... Israel this and that... Lu kewarganegaraan apa dodol!? Orang US? Orang Israel? Apa orang Indonesia? Urusin amat urusan Israel? Kalo mau identitas agama jangan bawa-bawa negara. Uda kaya kalo diaduin perang sama tuh dua bakalan menang aja.,legalygreen,2018-05-03,"[('malay', 1.0), ('indonesian', 0.9999809117254065), ('english', 0.7254267977829495)]",True,['dodol'],['Indonesian'],True,batch_1,rewire_singapore_383,"US... Israel... US this and that... Israel this and that... What nationality are you!? US? Israeli? Are you Indonesian? Do you really care about Israel? If you want a religious identity, don't bring your country. It's like if you fight a war with both of them, you'll win."
384,1588216184,fp0swaz,t3_gah95s,t3_gah95s,"Pempek, baso tahu, bakso, gudeg, rawon, soto betawi, sate ayam/kambing/babi, babi guling komplit + urutan + lawar merah",blackred44,2020-04-30,"[('indonesian', 1.0), ('malay', 0.8993132493220296), ('english', 0.8166615881205185)]",True,['babi'],['Indonesian'],True,batch_1,rewire_singapore_384,"Pempek, baso tahu, bakso, gudeg, rawon, soto betawi, chicken/goat/pork satay, babi guling komplit + order + red lawar"
385,1594221323,fxbj2dp,t3_hngvuc,t1_fxbafpa,PUKIMAK LONG TIME NO SEE.,thechineseninja,2020-07-08,"[('malay', 1.0), ('indonesian', 0.9957215023975536), ('english', 0.9799378635078626)]",True,['pukimak'],['Indonesian'],True,batch_1,rewire_singapore_385,PUKIMAK LONG TIME NO SEE.
386,1543847133,eb00p96,t3_a2f0db,t1_eazq9v7,"Betul tuh kalo lagi capek &amp; muka udah kucel biasanya gue juga males ketemu orang, apalagi cewek :p    
Takut bikin ill feel jadi lebih baik menghindar aja hehe",UltimateBishonenHero,2018-12-03,"[('indonesian', 1.0), ('malay', 0.9586722165193337), ('english', 0.6642837922080251)]",True,['kucel'],['Indonesian'],True,batch_1,rewire_singapore_386,"That's right, if I'm tired and my face is already dirty, I'm usually too lazy to meet people, especially girls :p
Afraid to make ill feel so it's better to just avoid hehe"
387,1654424591,ib8lsml,t3_v5ahue,t3_v5ahue,"Puan - Tommy, disingkat Puki",dbsiwbsisiabso,2022-06-05,"[('indonesian', 1.0), ('malay', 0.9365657521746356), ('english', 0.7446262388446804)]",True,['Puki'],['Indonesian'],True,batch_1,rewire_singapore_387,"Puan - Tommy, abbreviated as Puki"
388,1558943126,eoyn6on,t3_btj38v,t3_btj38v,He sibeh heng man,Jammy_buttons2,2019-05-27,"[('malay', 1.0), ('indonesian', 0.9096204367414382), ('english', 0.7959515896667759)]",True,['sibeh'],['Singlish'],True,batch_1,rewire_singapore_388,He sibeh heng man
389,1647856172,i1ifybu,t3_tipm3r,t3_tipm3r,Ternyata bondol masih mendominasi preferensi cowo. Tapi aku udah bosen bondol mau panjangin sepinggang. Tapi nanti ga laku di pasaran gmn?,4sehat5sempurna,2022-03-21,"[('indonesian', 1.0), ('malay', 0.9053537622144092), ('english', 0.6411664253546399)]",True,['bondol'],['Malay'],True,batch_1,rewire_singapore_389,It turns out that bondol still dominates men's preferences. But I'm tired of bondol want to lengthen the waist. But will not sell in the market gmn?
390,1641884454,hs6ftag,t3_s0otyb,t3_s0otyb,"akhirnya eek lg sesi ke2

teksturnya encer dan silit panas",pak_erte,2022-01-11,"[('indonesian', 1.0), ('malay', 0.9535018169276895), ('english', 0.6151354983013129)]",True,['silit'],['Indonesian'],True,batch_1,rewire_singapore_390,"finally eek lg 2nd session

the texture is watery and the silit is hot"
391,1501117667,dkrulc9,t3_6pmc3x,t3_6pmc3x,"Pencemaran nama uni karena takut diasosiasikan dengan grup homo?  
Seriously, kalau kejadiannya ada yang bikin grup khilafa grup domba surga brawijaya atau klub reliji lain, memangnya akan mendapatkan perlakuan serupa?  
Heran gue sama indon. Padahal apa bedanya sih yang menjadikan agama sebagai identitas dengan yang menjadikan seksualitas sebagai identitas?  Sama-sama konyol toh.",Xso2Hvn,2017-07-27,"[('indonesian', 1.0), ('malay', 0.9651792746628589), ('english', 0.6685875657023036)]",True,['konyol'],['indonesian'],True,batch_1,rewire_singapore_391,"Defamation of the uni name for fear of being associated with a gay group?
Seriously, if someone created a khilafa group, a brawijaya sheep paradise group or another religious club, would they get the same treatment?
I wonder about Indon. What's the difference between those who use religion as their identity and those who use sexuality as their identity?  Both are ridiculous anyway."
392,1652715492,i8tx9vd,t3_uqpp85,t1_i8tv7iy,"Bukan, tp di Batam kimcil artinya apa ya ?",Far-Caterpillar9294,2022-05-16,"[('indonesian', 1.0), ('malay', 0.9695677070356306), ('english', 0.7356263365640606)]",True,['kimcil'],['Indonesian'],True,batch_1,rewire_singapore_392,"No, but what does kimcil mean in Batam?"
393,1625487714,h44eso6,t3_oe2vdi,t3_oe2vdi,Tak faham aku ko layan Reddit untuk apa? Ko nak lancap gak pastu ko ingat ko boleh dpt pepek pmpuan Tu ke? Bila content takde ko bising dah Ada content sibuk pegi bgtau owner dia . Loser sial,Timely_Chance_5057,2021-07-05,"[('indonesian', 1.0), ('malay', 0.974837306685829), ('english', 0.7183608629045237)]",True,['pepek'],['Indonesian'],True,batch_1,rewire_singapore_393,I don't understand what you're serving Reddit for. You can't remember if you can get your girl's pepek? When content takde ko noisy dah There is content busy pegi bgtau owner him . Loser shit
394,1555588685,el6h53s,t3_bei41o,t3_bei41o,Demand cam cibai sengkek nak mampos,usernot_found,2019-04-18,"[('indonesian', 1.0), ('malay', 0.9758615499689861), ('english', 0.8222084096679767)]",True,['Cibai'],['Indonesian'],True,batch_1,rewire_singapore_394,Demand cam cibai sengkek nak mampos
395,1621380492,gymrckx,t3_nfklfg,t1_gymqlim,Niama cibai these helang,weecious,2021-05-19,"[('indonesian', 1.0), ('malay', 0.943549970844424), ('english', 0.9103427569511144)]",True,['Cibai'],['Indonesian'],True,batch_1,rewire_singapore_395,Niama cibai these helang
396,1654122479,iauc8q7,t3_v1j9rp,t3_v1j9rp,Ustadz Abdul Sohai,RaimuAsu,2022-06-01,"[('malay', 1.0), ('indonesian', 0.9323605606311222), ('english', 0.8888434943465184)]",True,['Sohai'],['Malay'],True,batch_1,rewire_singapore_396,Ustadz Abdul Sohai
397,1594322107,fxgbfqa,t3_ho7fux,t3_ho7fux,"Sori, gw akan ngerant(dan bakalan ada badword di komen gw ini).

JANCUK SEA GUARDIAN! GW UDH MAIN 3 JAM FULL KGA ADA YG DPT, SELALU LEPAS DAN BGSTNYA SELALU NGARAHIN KE BAR MERAH! NGAPAIN SIH MASANG S LINK PAKAI TUGAS, DAN TUGASNYA CEM AMPAS GINI CUK!!!!!!!!!",LostDepths,2020-07-09,"[('indonesian', 1.0), ('malay', 0.9892816385336816), ('english', 0.7742584747511602)]",True,"['ampas', 'jancuk']",['Indonesian'],True,batch_1,rewire_singapore_397,"Sori, gw akan ngerant (the bad word of the day).

JANCUK SEA GUARDIAN! GW UDH MAIN 3 JAM FULL KGA ADA YG DPT, SELALU LEPAS DAN BGSTNYA SELALU NGARAHIN KE BAR MERAH! NGAPAIN SIH MASANG S LINK PAKAI TUGAS, DAN TUGASNYA CEM AMPAS GINI CUK!!!!!!!!!"
398,1624303611,h2kjs9d,t3_o52126,t3_o52126,"Aku tak boleh deny benda ni sebab dapat gak siap ajak vc pastu dia moan lagi huhu,ada cara bukan terus cakap awak horny tak pala lancau 😂",dshoho123,2021-06-21,"[('malay', 1.0), ('indonesian', 0.9883580292458146), ('english', 0.6262563931063441)]",True,['Lancau '],['Malay'],True,batch_1,rewire_singapore_398,"I can't deny this thing because I can't be ready to invite vc, of course he moaned again huhu, there is a way not to keep talking about you horny not pala lancau 😂"
399,1652165136,i80t0wv,t3_u5nwt4,t3_u5nwt4,"apa gue salah banget karena bahagia di atas penderitaan orang lain?

background: gue selalu di tolol”in sama ortu karna nilainya selalu pas”an (gue sendiri ga punya ambisi buat menonjol di bidang apapun), kemarin pas datengin salah satu sepupu yang lebih tua dia ternyata belum ngurus skripsi samsek padahal gue udah lulus (masuknya barengan). gue tau setiap orang ada pacenya masing” dan gue ga terlalu peduli ke sepupu gue. fokus gue cuma pengen ngatain tolol ke ortu karna ga pernah bersyukur dapet anak yang ga neko”.",yepyepyea,2022-05-10,"[('indonesian', 1.0), ('malay', 0.9620812674703976), ('english', 0.6916041420417682)]",True,['Tolol'],['Indonesian'],True,batch_1,rewire_singapore_399,"Am I really wrong for being happy on top of other people's suffering?

background: I've always been dumbed down by my parents because my grades have always been mediocre (I myself have no ambition to stand out in any field), yesterday when I visited one of my older cousins he turned out to have not taken care of his thesis even though I had graduated (the entry was the same). I know everyone has their own girlfriends and I don't really care about my cousin. my focus is just on saying dumb to my parents for never being grateful to get a child who is not neko""."
400,1629599241,h9v2vx7,t3_p8y95m,t1_h9uuapw,"Resep pukimak udah bener sih, tapi ada 1 rahasia yg bikin nasgor enak: apinya harus gede banget. Sampe kayak jet engine. Di rumah mungkin gak bisa ya karena kompornya beda dengan yg di restoran atau punya si abang2, jadi semaksimalnya aja. Jadi setelah telornya setengah mateng, kecilin apinya, masukkin nasi, sayuran, n bahan lain, terus gedein apinya sampe max sambil aduk2.",Tofuboi9911,2021-08-22,"[('indonesian', 1.0), ('malay', 0.9610907434093413), ('english', 0.6718757638832304)]",True,['pukimak'],['Indonesian'],True,batch_1,rewire_singapore_400,"Pukimak's recipe is right, but there is one secret that makes nasgor delicious: the fire must be really big. Like a jet engine. At home, it might not be possible because the stove is different from the one in the restaurant or the brother's, so just make the most of it. So after the eggs are half cooked, reduce the heat, add the rice, vegetables, and other ingredients, then increase the heat to the max while stirring."
