,created_utc,id,link_id,parent_id,body,author,date,lang_score,in_scope,terms,termlangs,useful,batch,rewire_id,trans_deepl
605,1649822224,i4iuus0,t3_u2h1fn,t3_u2h1fn,"Hmm itinerarinya agak padat tp gak kerasa jalan2 banget yaa, sis? Berikut opini gue. 

&gt;1. **Apakah jadwal diatas cukup masuk akal? Kalau ada masukan, gw akan sangat berterimakasih.** masuk akal kok, gak terlalu padet... cuman jadi gak banyak yg disamperin juga, apakah ini gak akan bikin orang kayak ""ah gue mo sendiri/brpan ke tempat xyz aja deh dr pada bareng"" gitu gak? Selain itu, utk hari jumat... klo pada naik bis, kenapa barang gak disimpen di bis aja? Ntar check in pulang maen gitu (kalauuu nginepnya gak selewat jalur bis).


&gt;2. **Ada 1 orang yang punya GERD. Ga bisa makan telat, jam 7 mesti udah makan. Gw kepikiran buat beli snack box untuk hari Jumat dan Sabtu, gimana?** setuju utk ini, lebih baik disediain snack box yg agak berat kayak bolu gituan, pisang juga membantu. Jangan lupa selain yg gerd, sediain juga antimo yang banyak... 😅😅


&gt;3. **Cari tour guide atau ga usah untuk acara di Bedugul? Ada rekomendasi tour guide?. Gw mikir liburan ini udah mirip karyawisata, kenapa ga sekalian aja lol daripada selfie2an doang.** gak perlu rasanya pake tourguide, apalagi kalau gak berniat utk belajar sejarah gitu2nya... assuming paling cuman bisa ngunjungin 3-4 tempat sehari, kalau udah tau mau kemana aja, mending hemat biaya guide. Bedugul ini hari jumatnya kan yaa? Deket sana klo masih siang bisa sempet pulangnya ke Tanah Lot. Di daerah sana juga ada air terjun Kipu Kebo. 

&gt;4. **Group booking untuk Family Room ternyata lebih hemat. Tapi, resikonya ada keluarga yang digabung karena per kamarnya ada 5 bed gitu. Should I go for it? Atau tetap booking deluxe aja?. Budget kami 250rb per pax per malam, termasuk sarapan. Jadi, karena dapat penawaran harga untuk Family Room 1jt/malam/5pax termasuk sarapan di sebuah beach resort, menurut gw itu harga yang bagus banget sih** Ada brp remaja2 yg seumuran sis? Kalau mau enak, biasanya yg seumuran bisa digabung gitu, sepupu2. Kasih mereka di family room, jadi ortu2nya juga bisa sendiri. Kadang ada juga yg anak2 ditaro di kamar terpisah yg family room, trus minta siapa yg tidur bareng mereka... jadi yg gede2 enak sendiri juga. Selain itu, saran lainnya yaa sewa villa yg sekalian banyak kamarnya... setau gue gak gitu mahal kok klo 10orang or lebih. Skrg mungkin lebih mahal sih, tp dulu rate villa 4 kamar cuman 1.7jtan, muat 10-12orang, sifatnya agak pelosok sih... tp enak krn ada private pool, breakfast, gitu juga. 

&gt;5. **Beach resort atau hotel biasa?** kalau fokusnya jalan2, hotel biasa. Kalau bakal leha2 di hotel bareng keluarga, resort or villa. 

&gt;6. **Rekomendasi tempat lunch rombongan friendly yang makanannya BUKAN seafood. Babi is fine. Tapi, mesti ada makanan empuk dan berkuah karena simbah udah susah ngunyah.** hmm kurang tau kalau banyak yg manula 😅😅. Tp mostly kalau bikin reservasi gitu enak sih di mana2. Gue lupa dulu ada tpt makan yang bambu2 gitu di ubud, pernah kami 30orang jadi kayak rent satu ruangan sendiri makannya... tp lupa banget namanya apa. 

&gt;7. **Pengennya misa minggu di gereja. Sama ga syaratnya kayak misa tatap muka di Jakarta?. Tapi misa di hotel pun gapapa sih, yang penting sama2.** ini gue bener2 gak tau.",RandomizedID,2022-04-13,"[('indonesian', 1.0), ('malay', 0.972298457276866), ('english', 0.7734336741290088)]",True,['babi'],['Indonesian'],True,batch_1,rewire_singapore_605,"Hmm, the itinerary is a bit busy but it doesn't feel like a walk, sis? Here's my opinion.

1. **Does the above schedule make sense? If you have any input, I would be very grateful.** It makes sense, it's not too crowded... just so there's not much to see too, won't this make people like ""ah I'm going alone / just go to xyz place instead of together""? Also, for Friday... if you're taking the bus, why don't you keep your stuff on the bus? Then check in and go home (if you don't stay past the bus line).


&gt;2. **There is one person who has GERD. I can't eat late, I have to eat at 7 o'clock. I thought of buying a snack box for Friday and Saturday, how about it? ** I agree to this, it's better to provide a rather heavy snack box like sponge cake, bananas also help. Don't forget besides gerd, also provide a lot of antimo... 😅😅


3. **Looking for a tour guide or not for the event in Bedugul? Any tour guide recommendation? I think this vacation is already like a field trip, why don't you just do it lol instead of taking selfies.** There's no need to use a tourguide, especially if you don't intend to learn history... assuming you can only visit 3-4 places a day, if you already know where you want to go, it's better to save the cost of a guide. Bedugul is on Friday, right? Near there, if it's still afternoon, you can go back to Tanah Lot. There is also Kipu Kebo waterfall in that area.

4. **Group booking for Family Room is more economical. But, the risk is that there are families who are combined because there are 5 beds per room. Should I go for it? Or just keep booking deluxe? Our budget is 250k per pax per night, including breakfast. So, since I got an offer for a Family Room of 1jt/night/5pax including breakfast at a beach resort, I thought it was a really good price** How many teenagers are your age? If you want to be nice, usually you can combine the same age, cousins. Put them in the family room, so the parents can also be alone. Sometimes there are also those who put the kids in a separate family room, then ask who sleeps with them... so the big ones can be alone too. Other than that, another suggestion is to rent a villa with many rooms... as far as I know, it's not that expensive for 10 people or more. Now it might be more expensive, but in the past the rate for a 4-room villa was only 1.7jtan, fits 10-12 people, it's a bit remote anyway... but it's good because there is a private pool, breakfast, too.

5. **Beach resort or normal hotel? ** If the focus is on traveling, normal hotel. If you want to relax in a hotel with your family, resort or villa.

6. **Recommended group friendly lunch spot with food that is NOT seafood. Pork is fine. But, there must be soft and soupy food because it's hard for me to chew.** hmm don't know if there are many seniors 😅😅. But mostly if you make a reservation, it's good everywhere. I forgot there used to be a bamboo dining place in Ubud, once we were 30 people so it was like we rented a room to eat alone... but I forgot what it was called.

&gt;7. **Want to have Sunday mass at church. Isn't the same requirement as face-to-face mass in Jakarta? But even having mass in a hotel is fine, the important thing is the same.** I really don't know."
606,1634854590,hhjpgck,t3_qcm60l,t3_qcm60l,"Buat mereka yang tidak tahu, kemungkinan akan merasa terancam atau norak?  
Buat yang menyamar jadi Pink Soldier, pada pakai masker di balik topeng atau nggak?  
Pemborosan anggaran buat beli kostum semacam itu, ya.",manusiaampas,2021-10-21,"[('indonesian', 1.0), ('malay', 0.9983553931938023), ('english', 0.6283549558269056)]",True,['norak'],['Indonesian'],True,batch_1,rewire_singapore_606,"For those who don't know, are they likely to feel threatened or tacky?
For those disguised as Pink Soldier, do you wear a mask underneath the mask or not?
It's a waste of money to buy that kind of costume."
607,1584879936,fl6qesu,t3_fmwl7r,t1_fl6evuc,klo ga disebut tolol mo disebut apalagi ? ( ͡° ͜ʖ ͡°),aldiyoooo,2020-03-22,"[('indonesian', 1.0), ('malay', 0.8577087091590473), ('english', 0.6901226195912168)]",True,['Tolol'],['Indonesian'],True,batch_1,rewire_singapore_607,"If you're not called a moron, what else are you called? (͡° ͜ʖ ͡°)"
608,1495882997,di3vtwi,t3_6dk0pd,t1_di3q14a,*Kurang asam*,harimaochan,2017-05-27,"[('malay', 1.0), ('indonesian', 0.9566697377582294), ('english', 0.6655141911429007)]",True,['kurang asam'],['Malay'],True,batch_1,rewire_singapore_608,*Less acid*
609,1581043252,fgrc789,t3_ezp924,t3_ezp924,ngewe sih,kodokhutan,2020-02-07,"[('indonesian', 1.0), ('malay', 0.9883346030364042), ('english', 0.9211365466175566)]",True,['ngewe'],['indonesian'],True,batch_1,rewire_singapore_609,ngewe sih
610,1554097780,ejuw6v2,t3_b7pya7,t3_b7pya7,ibu2 di kantor ngomongin lolok nya prab*w* di potong :(,internweb,2019-04-01,"[('indonesian', 1.0), ('malay', 0.8319474419977332), ('english', 0.7523764979373052)]",True,['lolok'],['Malay'],True,batch_1,rewire_singapore_610,the moms in the office are talking about prab*w*'s lolok being cut off :(
611,1564286569,ev8p4dp,t3_cijtbl,t1_ev86m47,"gw sekali ikut jurig malam waktu masih SD, waktu masih polos.",ysupr,2019-07-28,"[('indonesian', 1.0), ('malay', 0.9623798302609473), ('english', 0.6785130537773738)]",True,['jurig'],['Indonesian'],True,batch_1,rewire_singapore_611,"I joined jurig malam once when I was in elementary school, when I was still innocent."
612,1589199912,fq9jbft,t3_gh5rg9,t1_fq9i8kg,Ga ngerti lg kenapa sepupu gw semua punya anak minimal 2-3 ud denger semua struggle mereka ada yg siap ada ga jd kek gitu deh apalg skrg lg gini wkwkw di rumah semua gatau masih pake pembantu 3 biji apa ga 😵,flowerthorns,2020-05-11,"[('indonesian', 1.0), ('malay', 0.9913245774962645), ('english', 0.7099425981630341)]",True,['biji'],['Indonesian'],True,batch_1,rewire_singapore_612,I don't understand why my cousins all have children at least 2-3 ud hear all their struggles there are those who are ready there are not so deh apalg skrg lg like this wkwkw at home all I don't know if I still use 3 maids or not 😵
613,1649489095,i40atnm,t3_tz880l,t1_i409w8y,"Mayoritas charger menggunakan sistem switching dalam merubah arus AC ke DC. Salah satu efek sampingnya bakalan ada noise frekuensi tinggi karena proses switching tadi. Tapi charger baru yg didesain dengan standard yg baik seharusnya nggak sampai keluar bunyi yg audible.    
    
Dalam hal ini IMHO ada 2 kemungkinan: 1) lu punya pendengaran yg bagus
2) chargernya nggak mengikuti standard keamanan/cacat produksi.",perseveringsloth,2022-04-09,"[('indonesian', 1.0), ('malay', 0.9532190143547126), ('english', 0.6845948046991565)]",True,['cacat'],['Indonesian'],True,batch_1,rewire_singapore_613,"The majority of chargers use a switching system in converting AC current to DC. One of the side effects will be high frequency noise due to the switching process. But a new charger designed to a good standard should not make an audible noise.    
    
In this case IMHO there are 2 possibilities: 1) you have good hearing
2) the charger does not follow safety standards / production defects."
614,1657511902,ifok3sv,t3_vvnz32,t1_ifo0x0o,"Apa hambatan OP dalam belajar? 
Saya tertarik karena baru tau autisme bisa bermain Reddit. Saudara saya autis soalnya tidak bisa",desktoppc,2022-07-11,"[('indonesian', 1.0), ('malay', 0.9275929680160357), ('english', 0.5861000961307378)]",True,['autis'],['Indonesian'],True,batch_1,rewire_singapore_614,"What are OP's barriers to learning?
I'm interested because I just found out that autism can play Reddit. My brother is autistic so he can't"
615,1603267810,g9it5cp,t3_jf6p2o,t3_jf6p2o,burit besangkadi,LutungJelek,2020-10-21,"[('indonesian', 1.0), ('malay', 0.9275225117041122), ('english', 0.8283284658236179)]",True,['burit'],['indonesian'],True,batch_1,rewire_singapore_615,burit besangkadi
616,1626212072,h531hsd,t3_oclyta,t1_h45jsdx,"hahaha apa plak transgender. hahaha Ada pepek tu bro , silap org hehe",Sensitive-Laugh8555,2021-07-13,"[('indonesian', 1.0), ('malay', 0.9650446886744193), ('english', 0.9005096107334556)]",True,['pepek'],['Indonesian'],True,batch_1,rewire_singapore_616,"hahaha what transgender plaque. hahaha There's a pepek tu bro, silap org hehe"
617,1618392132,gugwk7w,t3_mq6mkf,t1_gugw066,Setelah adu jotos ama adek gw yg sma dan autis (pikirannya kyk anak kecil 6 sd) terus gua nyesel.,Representative_woy87,2021-04-14,"[('indonesian', 1.0), ('malay', 0.9491409006697921), ('english', 0.7111579027291441)]",True,['autis'],['Indonesian'],True,batch_1,rewire_singapore_617,"After a fistfight with my high school-aged, autistic brother (he thinks like a 6-year-old), I regretted it."
618,1639926860,hp6aw09,t3_rjviox,t3_rjviox,"Freefire

Gamenya sebenarnya sangat amat jelek, tapi disini populer karena hape burik.",nonexistantchlp,2021-12-19,"[('indonesian', 1.0), ('malay', 0.9108172669823116), ('english', 0.7149198135162678)]",True,['burik'],['Indonesian'],True,batch_1,rewire_singapore_618,"Freefire

The game is actually very, very bad, but it's popular here because of the burik hape."
619,1610975290,gjpt8us,t3_kza68u,t1_gjps79t,"Penduduk setempat tergeser ke pinggir kota/daerah ""kumuh"" karena pendatang yang lebih kaya membuat harga2 naik terutama harga tanah

Mis: orang Betawi di Jakarta",Kuuderia,2021-01-18,"[('indonesian', 1.0), ('malay', 0.9815334469115639), ('english', 0.6278613888138341)]",True,['kumuh'],['indonesian'],True,batch_1,rewire_singapore_619,"Locals are displaced to the suburbs/""slums"" as richer migrants drive up prices, especially land prices.

Ex: Betawi people in Jakarta"
620,1623216981,h14cqq6,t3_nvkexw,t1_h13rbxj,halo cibai. kayanya itu lumayan pas,soemarkoridwan,2021-06-09,"[('indonesian', 1.0), ('malay', 0.9321309663134075), ('english', 0.7636538228632378)]",True,['Cibai'],['Indonesian'],True,batch_1,rewire_singapore_620,hello cibai. I think it's pretty fitting.
621,1652334923,i8aanyb,t3_unr6tu,t3_unr6tu,"Kalau kenyataan sudah berkelamin sebagaimana wanita pada umumnya, masa tetap ditulis pria di KTP. Bukannya jadi cacat dokumennya, tidak mencerminkan kenyataan?",8styx8,2022-05-12,"[('indonesian', 1.0), ('malay', 0.9806556908855495), ('english', 0.5980390437048917)]",True,['cacat'],['Indonesian'],True,batch_1,rewire_singapore_621,"If the reality is that you have the sex of a woman in general, you still write male on your ID card. Isn't it a flawed document, not reflecting reality?"
622,1594040566,fx3fr74,t3_hm57p9,t3_hm57p9,His hair so ah beng sia,blissfulreveriee,2020-07-06,"[('malay', 1.0), ('indonesian', 0.9716112894090995), ('english', 0.9390098580868811)]",True,['Ah Beng'],['Singlish'],True,batch_1,rewire_singapore_622,His hair so ah beng sia
623,1510126762,dpijph8,t3_7bjtlo,t1_dpijkcs,"[wikipedia](https://id.wikipedia.org/wiki/Indon), kalo menurut wikipedia kata Indon dipake orang malay buat penyebutan negara dan rakyat indonesia, di indonesia sendiri istilah ini punya konotasi negatif dan dianggap rasis setara dengan kata negro (nigger), rakyat dan pemerintah indonesia menentang penggunakan kata tersebut, KBRI di kuala lumpur udah berkali2 ngirim surat protes kepada media di Malaysia yang bersikukuh menggunakan istilah ini meski dinilai memiliki konotasi negatif.",DontDoItMom,2017-11-08,"[('indonesian', 1.0), ('malay', 0.973887783025414), ('english', 0.7036172593965687)]",True,['negro '],['Malay'],True,batch_1,rewire_singapore_623,"[wikipedia](https://id.wikipedia.org/wiki/Indon), according to wikipedia the word Indon is used by Malaysians to refer to the country and people of Indonesia, in Indonesia itself this term has a negative connotation and is considered racist equivalent to the word negro (nigger), the people and government of Indonesia oppose the use of the word, the Indonesian Embassy in kuala lumpur has repeatedly sent letters of protest to the media in Malaysia who insist on using this term even though it is considered to have a negative connotation."
624,1635852829,hizzg64,t3_qkiils,t1_hizm2kb,omeigat mpusnya super gembrot,syrlind,2021-11-02,"[('indonesian', 1.0), ('malay', 0.9418794561083045), ('english', 0.8028582766526311)]",True,['gembrot'],['Indonesian'],True,batch_1,rewire_singapore_624,omeigat mpus super gembrot
625,1523894221,dxghzxj,t3_8cmsqb,t3_8cmsqb,"Haha liat tuh cebong turun ke jalan, seorang pasti dapet jatah nasi kotak. Yang berani bakar foto bonus rendang /s",Astargea,2018-04-16,"[('indonesian', 1.0), ('malay', 0.9695583995977168), ('english', 0.7064923019241018)]",True,['cebong'],['Indonesian'],True,batch_1,rewire_singapore_625,"Haha look at the cebong taking to the streets, one must get a rice box ration. Those who dare to burn photos bonus rendang /s"
626,1649812770,i4ia55v,t3_u1yijg,t3_u1yijg,"1. Sering bgt dulu pas di Indo, dan dari gue kecil. Pelaku nya dari semua rentang umur. Cat call iya (usually racially-charged jg krn gue Chinese), sexual harassment juga (dicolek, mrk col* di depan gue, etc). Sejak tinggal di Eropa, msh terjadi tapi jauh lebih jarang cuma biasanya orang mabok aja, atau saat di daerah agak ghetto dan malem-malem.

2. Enggan keluar ke jalanan. Kalo harus ke jalanan, minta ditemenin. Pake baju paling kucel (meskipun kaga ngaruh sama sekali, cuma merasa lebih safe aja sendiri).",idiot-sandwich-,2022-04-13,"[('indonesian', 1.0), ('malay', 0.9544872258365706), ('english', 0.7532697966638203)]",True,['kucel'],['Indonesian'],True,batch_1,rewire_singapore_626,"1. I used to do it a lot when I was in Indo, and since I was a kid. Perpetrators from all age ranges. Cat calls yes (usually racially-charged too because I'm Chinese), sexual harassment too (poked, they p*ssed in front of me, etc). Since living in Europe, it still happens but much less often, it's usually drunk people, or in ghetto areas and late at night.

2. Reluctant to go out on the streets. If you have to go to the streets, ask to be accompanied. Wear the shabbiest clothes (even though it doesn't affect me at all, I just feel safer alone)."
627,1625980866,h4s3o50,t3_ohxctw,t1_h4s2j45,"I see, jadi itu alasannya kenapa spy suka nyamar jadi pelacur.",ManggaAsem,2021-07-11,"[('indonesian', 1.0), ('malay', 0.9872931367942899), ('english', 0.7167376360237954)]",True,['pelacur'],['Indonesian'],True,batch_1,rewire_singapore_627,"I see, so that's why spy likes to pose as a prostitute."
628,1589541221,fqpb18n,t3_gjpei7,t1_fqp14x1,"Yes, yes it is.  Hontou no palui bah kau.",FaxSmoulder,2020-05-15,"[('indonesian', 1.0), ('malay', 0.9453539726900188), ('english', 0.9429317526618947)]",True,['Palui'],['Malay'],True,batch_1,rewire_singapore_628,"Yes, yes it is.  Hontou no palui bah kau."
629,1645180442,hxfipg5,t3_q8wxld,t3_q8wxld,Bapa siapalah ni habis satu keturunan boleh jahanam,sh4doi,2022-02-18,"[('indonesian', 1.0), ('malay', 0.9973769534043098), ('english', 0.6502028808838747)]",True,['Jahanam'],['Malay'],True,batch_1,rewire_singapore_629,Father who is this exhausted one offspring can be evil
630,1635620627,hiocwzn,t3_qj4dee,t1_hio0ydb,sensasi gimana itu netnot sama jurig,white_kucing,2021-10-30,"[('indonesian', 1.0), ('malay', 0.9286267109711098), ('english', 0.7973659008476056)]",True,['jurig'],['Indonesian'],True,batch_1,rewire_singapore_630,What is the sensation of netnot and jurig?
631,1652622580,i8p1myi,t3_uplgpp,t3_uplgpp,"Banyak. 

Salah satunya, nyokap suka bilang dia malu krn teman2nya bilang gue dekil. Ngomongnya dgn ekspresi jijik gitu.

Nape nyalahin gue yg anak2, hrsnya dia yg malu, sbg ibu ga ngajarin anak kebersihan tubuh &amp; ngasih gizi yg baik. 

* Gue mandi 2x/hari. Cuma ya ga keurus ya mungkin...rambut merah awut2an, kulit gelap (suka main..nyokap bomat, dia tiap hari ga di rumah pergi kongkow), kusam, badan ceking. Looking back gw tu kurang gizi deh kyknya.",cloverhoney12,2022-05-15,"[('indonesian', 1.0), ('malay', 0.98066840448554), ('english', 0.7411719443426802)]",True,"['ceking', 'dekil']",['Indonesian'],True,batch_1,rewire_singapore_631,"Many.

For one, my mom likes to say she's embarrassed because her friends say I'm dirty. She said it with a disgusted expression.

Instead of blaming me for my children, she should be ashamed that as a mother, she didn't teach her children about body hygiene and good nutrition.

* I shower 2x/day. It's just that I didn't take care of it, maybe...red hair, dark skin (like playing...my mom's a bomat, she's not home every day to hang out), dull, skinny body. Looking back I was malnourished deh I guess."
632,1609297714,ghgn6vg,t3_kmsbl4,t1_ghgmn2h,wah lau why he jiang bad de,woonie,2020-12-30,"[('malay', 1.0), ('indonesian', 0.9951531580901939), ('english', 0.937491220989958)]",True,['wah lau'],['Singlish'],True,batch_1,rewire_singapore_632,wah lau why he jiang bad de
633,1563470023,eu54zxz,t3_cesj6x,t1_eu54ahd,"Nah kan, gilette itu haram jadah!",alphadeeto,2019-07-18,"[('malay', 1.0), ('indonesian', 0.9707525246865976), ('english', 0.8900153094112591)]",True,['haram jadah'],['Malay'],True,batch_1,rewire_singapore_633,"That's right, gilette is a bastard!"
634,1638594457,hn5tsbm,t3_r83s4v,t3_r83s4v,Si dodol sekarang kalo jalan nyasar mulu...,humicumi,2021-12-04,"[('indonesian', 1.0), ('malay', 0.9817408202253173), ('english', 0.7198618510067851)]",True,['dodol'],['Indonesian'],True,batch_1,rewire_singapore_634,The dodol now when the road strayed ...
635,1580117863,ffq3665,t3_euif3x,t1_ffprgg8,I loled at kimak😂,davidnea3,2020-01-27,"[('indonesian', 1.0), ('malay', 0.979508568319884), ('english', 0.9762335080426532)]",True,['kimak'],['Indonesian'],True,batch_1,rewire_singapore_635,I laughed at kimak😂
636,1625663764,h4cmir9,t3_ofgm8x,t1_h4cjzc4,Inputnya emang gembel gan. Gak realtime. Bisa jadi seminggu baru masuk.,milkywaycastle,2021-07-07,"[('indonesian', 1.0), ('malay', 0.9848795725188668), ('english', 0.6577383555624136)]",True,['gembel'],['Indonesian'],True,batch_1,rewire_singapore_636,The input is crazy gan. Not realtime. It could be a week before it comes in.
637,1539505363,e7ql0jw,t3_9ns0h6,t1_e7psyjz,"Yang ngebocorin keliatannya tipikal maho caper sih, cek aja website pribadinya. Jijik super.",ksatriamelayu,2018-10-14,"[('indonesian', 1.0), ('malay', 0.8963337851300058), ('english', 0.7449751520499652)]",True,['maho'],['Indonesian'],True,batch_1,rewire_singapore_637,"The one who leaked it seems to be a typical maho caper anyway, just check his personal website. Super disgusted."
638,1573365777,f72juwy,t3_du7j8r,t1_f72ircw,Kadrun: NAH INI LAH Goodebner!! KGK Seperti TOGOG cebong!!!,qeqe1213,2019-11-10,"[('indonesian', 1.0), ('malay', 0.927996722332204), ('english', 0.9042854613978399)]",True,['cebong'],['Indonesian'],True,batch_1,rewire_singapore_638,Kadrun: NAH INI LAH Goodebner!! KGK Seperti TOGOG cebong!!!
639,1602645554,g8rh2of,t3_jaai1v,t3_jaai1v,"Lonte: pak masih inget kita ga?🥰  
Anggota DPR: &gt;!UU ITE time😎!&lt;",terbuang,2020-10-14,"[('indonesian', 1.0), ('malay', 0.8925268012589329), ('english', 0.7100331913541914)]",True,['Lonte'],['Indonesian'],True,batch_1,rewire_singapore_639,"Prostitute: Sir, do you still remember us? 🥰
Member of the House of Representatives: ""ITE Law time😎!"
640,1568134250,eztn8xd,t3_d1u2by,t1_eztm2z7,"&gt;!gua agak ngerti sih. sebenernya banyak scene di tenki no ko (misal pas mereka interview peramal di awal) keliatan ga penting, tapi sebenernya penting.!&lt;

&gt;!kan dikasih tau kalo bisa aja di awan itu ada ""kolam"" lain. jadi diawan itu ya emang kolam, yang banyak ikannya. di sana ada naga (dewa mungkin?) yang ditunjukkin pas suga &amp; natsumi interview kakek kakek. nah kalo gw pahamnya dia yang mengabulkan permintaan, tapi dia yang bakal ambil korbannya ke dunia mereka.!&lt;

&gt;!emang ada beberapa yang agak aneh sih. sebelum hina di bawa ke atas, kan sampe bersalju tuh karena dingin banget. tapi kok pas dia balik ke bumi hujannya ga gitu deres? emang sih tokyo nya sampe banjir tapi setelah 3 tahun ya ga gitu parah hujannya!&lt;",ezkailez,2019-09-10,"[('indonesian', 1.0), ('malay', 0.9565911572883), ('english', 0.7263922647740519)]",True,['hina'],['Indonesian'],True,batch_1,rewire_singapore_640,"I kind of understand. actually many scenes in Tenki No Ko (for example when they interviewed the fortune teller at the beginning) seem unimportant, but are actually important.!&lt;

we were told that there could be another ""pond"" in the cloud. so it's really a pond, with lots of fish. there's a dragon (god maybe?) that was shown when suga & natsumi interviewed grandpa. from my understanding, he's the one who grants wishes, but he's the one who will take the victims to their world!!!

There are some things that are a bit strange. before hina was taken upstairs, it was snowing because it was really cold. but how come when she returned to earth the rain wasn't so heavy? Indeed, tokyo was flooded but after 3 years the rain wasn't so bad!"
641,1487146396,ddrnmwx,t3_5u1eh7,t1_ddrnd7c,"Iya bener, harus dilaporin ini seriusan. Asal jelas aja TPS mana dan ada buktinya. Pecundang-pecundang pada main curang ini.",TrukTanah,2017-02-15,"[('indonesian', 1.0), ('malay', 0.9427841158054692), ('english', 0.7022418382400422)]",True,['pecundang'],['Indonesian'],True,batch_1,rewire_singapore_641,"Yes, this must be reported seriously. As long as it is clear which TPS and there is evidence. These losers are cheating."
642,1661333477,ilkmvsg,t3_wwcyk3,t1_ilklgao,Antara makan tai mamusia ato makan manusia,walktheline232,2022-08-24,"[('indonesian', 1.0), ('malay', 0.9684474052971545), ('english', 0.7174617186262902)]",True,['makan tai'],['Indonesian'],True,batch_1,rewire_singapore_642,Either eat a human or eat a human.
643,1659112624,ii5aqqi,t3_wafrzb,t3_wafrzb,"Ngehe, mau nya apa sih nih org? Bentar mau bentar ga, klo mau yah mau, jgn ambigu, gw butuh nya 0 atau 1 macem bit, bukan stengah2",fuckedupkid_yo,2022-07-29,"[('indonesian', 1.0), ('malay', 0.9114972638901044), ('english', 0.7438283500808227)]",True,"['butuh', 'ngehe']","['Indonesian', 'Malay']",True,batch_1,rewire_singapore_643,"Ngehe, what do you want? I don't want it for a while, if you want it, don't be ambiguous, I need 0 or 1 bit, not halfway."
644,1529641660,e13b2pj,t3_8sppxl,t1_e11z65l,"Pecun = pembawa cun(t)

The cunt bringer 👌",alphadeeto,2018-06-22,"[('indonesian', 1.0), ('malay', 0.9914348771000513), ('english', 0.9326954098484714)]",True,['pecun'],['Indonesian'],True,batch_1,rewire_singapore_644,"Pecun = cun(t) carrier

The cunt bringer 👌"
