,created_utc,id,link_id,parent_id,body,author,date,lang_score,in_scope,terms,termlangs,useful,batch,rewire_id,trans_deepl
152,1618994680,gvaxq0u,t3_muv2mq,t1_gvaxkl3,bagus bodat. menyiapkan mental anak muda sejak dini. kadang force majeure terjadi tapi kewajiban gak boleh lupa.,collectivekicks,2021-04-21,"[('indonesian', 1.0), ('malay', 0.9001352408867117), ('english', 0.6533360425303177)]",True,['bodat'],['Indonesian'],True,batch_1,rewire_singapore_152,good bodat. prepare the mentality of young people early. sometimes force majeure occurs but obligations must not be forgotten.
153,1612124640,glil0ff,t3_l90aqz,t3_l90aqz,"1. Pindah role dan ga cocok. Kalaupun balik ke role awal, skill berasa mentok dan ketemu hal yang sama tiap hari.

2. Toxic environment, seminggu cuman kerja 2-3 hari tapi coworkers bego ga ada yang bisa kerja, dan orangnya pada barbar. Cuma bertahan 1 bulan.

3. OTW resign, naik gaji dan posisi susah, mesti jadi butt licker atasan-atasan kalau mau dapet bonus gede. Meanwhile yang bukan butt licker tapi kerjanya keras, bonusnya biasa aja.",awkward_programmer,2021-01-31,"[('indonesian', 1.0), ('malay', 0.9749705396070332), ('english', 0.7507163346812079)]",True,['bego'],['Indonesian'],True,batch_1,rewire_singapore_153,"1. Switching roles and not fitting in. Even if you return to your original role, your skills feel stuck and you encounter the same things every day.

2. Toxic environment, only worked 2-3 days a week but the coworkers were so stupid no one could work, and the people were barbaric. Only lasted 1 month.

3. OTW resign, salary increases and positions are difficult, must be a butt licker of superiors if you want to get a big bonus. Meanwhile, if you're not a butt licker but work hard, you'll get a normal bonus."
154,1652859537,i91rd79,t3_us6bzg,t1_i91mdvc,"Kalau ga tau kan gapapa, makan di chinese food yg tulisannya kanji aja",theblackmandarin,2022-05-18,"[('indonesian', 1.0), ('malay', 0.9718645024624392), ('english', 0.7624283230969806)]",True,['kanji'],['indonesian'],True,batch_1,rewire_singapore_154,"If you don't know, it's okay to eat Chinese food with kanji."
155,1601078972,g6l7o76,t3_izau3a,t1_g6kxafo,Mmmm no they dont ngentot sebelum nikah if they prefer menikah muda. Pergaulan lo aja terlalu bebas,WhiteBinky,2020-09-26,"[('indonesian', 1.0), ('malay', 0.9507171833164783), ('english', 0.7804508216577279)]",True,['ngentot'],['Indonesian'],True,batch_1,rewire_singapore_155,Mmmm no they dont fuck before marriage if they prefer to marry young. You're just too promiscuous
156,1619666948,gw98btx,t3_n0u0nz,t1_gw917o9,Sibeh?,Cubyface,2021-04-29,"[('malay', 1.0), ('indonesian', 0.8611964544266696), ('english', 0.8202243411869566)]",True,['sibeh'],['Singlish'],True,batch_1,rewire_singapore_156,Sibeh?
157,1567575667,eyy8uab,t3_czdrd1,t1_eyxp1go,"&gt;dan klaim layanan kesehatan dari BPJS Kesehatan yang belum optimal

What ?? mereka kira yg pake BPJS harus disamakan dgn asuransi biasa dan yg mandiri ? udah dikasih murah protes, minta yg lengkap, pekok e.",elonelon,2019-09-04,"[('indonesian', 1.0), ('malay', 0.9321695777962685), ('english', 0.6327122348910026)]",True,['pekok'],['Indonesian'],True,batch_1,rewire_singapore_157,"and health service claims from BPJS Health that have not been optimized

What? They think those who use BPJS should be equalized with regular insurance and independent ones? Already given cheap protests, ask for complete, pekok e."
158,1634856247,hhjt2w4,t3_qcweis,t1_hhii1wc,Ada jurig,nvlicious,2021-10-21,"[('indonesian', 1.0), ('malay', 0.9967969092840416), ('english', 0.9772657820667472)]",True,['jurig'],['Indonesian'],True,batch_1,rewire_singapore_158,There is jurig
159,1646649577,hzotmjm,t3_t8k3di,t1_hzosh09,tatetot tatetot kontol kontol DASAR MEMEK,TheBlazingPhoenix,2022-03-07,"[('malay', 1.0), ('indonesian', 0.9758571979746212), ('english', 0.8565773420142835)]",True,"['kontol', 'memek']",['Indonesian'],True,batch_1,rewire_singapore_159,tatetot tatetot account account DASAR MEMEK
160,1614755997,gpies1l,t3_lwjeji,t3_lwjeji,ham ka chan,phyloem,2021-03-03,"[('malay', 1.0), ('indonesian', 0.9669852772182189), ('english', 0.8541522367383984)]",True,['ham ka chan'],['Singlish'],True,batch_1,rewire_singapore_160,ham ka khan
161,1625965504,h4re742,t3_ohf1id,t1_h4otpoj,"Counterpoint: kalau gizi anak-anak Indonesia membaik, apakah mereka masih akan cebol karena takdir genetik yang menuliskan demikian?",Salah_Ketik,2021-07-11,"[('indonesian', 1.0), ('malay', 0.9354052119685529), ('english', 0.670219246941763)]",True,['cebol'],['Indonesian'],True,batch_1,rewire_singapore_161,"Counterpoint: if the nutrition of Indonesian children improves, will they still be midgets because their genetic destiny dictates so?"
162,1645373150,hxpsk9i,t3_sx2m43,t1_hxpk4n6,"Eits, siapa tau.

Levi aja yang cebol bisa ngebantai Titan eak'",WhoSainT,2022-02-20,"[('indonesian', 1.0), ('malay', 0.9869556226569483), ('english', 0.7943463951052224)]",True,['cebol'],['Indonesian'],True,batch_1,rewire_singapore_162,"Eits, who knows.

Even midget Levi can slaughter Titan eak'"
163,1656367348,idzb6eg,t3_vm0uh9,t1_idza3c8,"iya kolor w dicolong dia soalnya

si kehed",friedchickenshit,2022-06-27,"[('malay', 1.0), ('indonesian', 0.98750508837847), ('english', 0.8268403961177659)]",True,['kehed'],['Indonesian'],True,batch_1,rewire_singapore_163,"Yes, the collar was stolen by him because

the kehed"
164,1643615705,huyw3to,t3_sgdk7x,t3_sgdk7x,"saya membuka open recruitment sekte baru yaitu henceut bereum cult, yang mau join silahkan copas flair saya 🙏🏻",friedchickenshit,2022-01-31,"[('indonesian', 1.0), ('malay', 0.9541029164167726), ('english', 0.8011700359082563)]",True,['henceut'],['indonesian'],True,batch_1,rewire_singapore_164,"I opened a new sect recruitment open, namely henceut bereum cult, who wants to join please copy my flair 🙏🏻"
165,1537982945,e6okqxn,t3_9j4kqz,t3_9j4kqz,"Terlalu normal mungkin lo, kurang pekok dikit.",Titikkoma95,2018-09-26,"[('indonesian', 1.0), ('malay', 0.9983133506823177), ('english', 0.6628936104912649)]",True,['pekok'],['Indonesian'],True,batch_1,rewire_singapore_165,"Too normal maybe you, a little less pekok."
166,1568873551,f0r47a4,t3_d67c65,t1_f0qwrwi,Cibai-man,Alpha3007,2019-09-19,"[('indonesian', 1.0), ('malay', 0.9383663732684816), ('english', 0.8337646506076114)]",True,['Cibai'],['Indonesian'],True,batch_1,rewire_singapore_166,Cibai-man
167,1511564297,dqam9ag,t3_7f8pyd,t1_dqa59lq,"**Puthut EA - Para Bajingan Yang Menyenangkan**. Buku terbangsat sejauh ini. Ada rekomendasi buku2 yang gak takut soal sensor bahasa? Kalau bisa sih buku bahasa Indonesia sih, tapi kalo ada yang bahasa Inggris pun juga oke",ibhi19,2017-11-24,"[('indonesian', 1.0), ('malay', 0.9213091813584053), ('english', 0.5655784679095359)]",True,['bajingan'],['Indonesian'],True,batch_1,rewire_singapore_167,"**Puthut EA - The Lovely Bastards**. The worst book so far. Any recommendations for books that aren't afraid of language censorship? If possible, Indonesian books, but if there are English ones, that's fine too."
168,1633747901,hfxp66t,t3_q420lx,t1_hfxk645,"Memang kaya =/= mengurus peliharaan dengan baik. Temenku ada yang mamanya gitu juga. Padahal anjingnya pom. Tiap ke rumahnya berisik banget, gonggong terus. I guess it's doing what the owner wants ¯\\\_(ツ)\_/¯",rumraisinisgood,2021-10-09,"[('indonesian', 1.0), ('malay', 0.9857488859457205), ('english', 0.6676514597642998)]",True,['gonggong'],['Indonesian'],True,batch_1,rewire_singapore_168,"It's rich =/= taking good care of pets. I have a friend whose mom does that too. Even though the dog is a pom. Every time I go to her house, it's so noisy, barking all the time. I guess it's doing what the owner wants ¯\\\\_(ツ)\_/¯"
169,1512745877,dqybg99,t3_7i7tlx,t1_dqyax5f,"""matamu picek"" bales gitu",FullyArmedDong,2017-12-08,"[('indonesian', 1.0), ('malay', 0.988713605082054), ('english', 0.8885034755164343)]",True,['picek'],['Indonesian'],True,batch_1,rewire_singapore_169,"""matamu picek"" bales gitu"
170,1581145762,fgvdl3q,t3_f06n48,t1_fgs1jsk,"Kalo temen lu bingung gmana cara orang sunda ngajak brantem, coba dengerin orang jogja ngajak brantem. Gua dlu d ajak brantem temen kantor pas dia kalah main dota terus gua trashtalk. I'm the asshole in this Story ofc, but when he talking shit in javanese i don't understand a words and thoughts he's making a joke about culinary (bajigur, telo, dll)",_WE_KILL_THE_BATMAN_,2020-02-08,"[('indonesian', 1.0), ('malay', 0.9458274643961615), ('english', 0.918671719199405)]",True,['bajigur'],['Indonesian'],True,batch_1,rewire_singapore_170,"Kalo temen lu bingung gmana cara orang sunda ngajak brantem, coba dengerin orang jogja ngajak brantem. Gua dlu d ajak brantem temen kantor pas dia kalah main dota terus gua trashtalk. I'm the asshole in this Story ofc, but when he talking shit in javanese i don't understand a words and thoughts he's making a joke about culinary (bajigur, telo, dll)"
171,1529693367,e14gxcl,t3_8szv2h,t3_8szv2h,Magelang Kota Sejuta Kimcil ,alphadeeto,2018-06-22,"[('indonesian', 1.0), ('malay', 0.9468335244697574), ('english', 0.7078530741724048)]",True,['kimcil'],['Indonesian'],True,batch_1,rewire_singapore_171,Magelang Kota Sejuta Kimcil
172,1512516642,dqtqzcl,t3_7hpphm,t3_7hpphm,"karena hanya iblis dan setan dan jin kaffirr pembawa mudharot yang takut dan menjauhi koran.  
yang mampu menghafal kitab suci itu sudah pasti manusia sholeh/a yang berguna bagi khilafa dunia akherat. tidak sia-sia kalo disekolahkan, bisa membawa kedamaian dan kehilafahan di negeri kaffirr tujuan sekolah.  
  
rambutan lilamin.",Xso2Hvn,2017-12-05,"[('indonesian', 1.0), ('malay', 0.9782045923481494), ('english', 0.6826056495133968)]",True,['setan'],['Indonesian'],True,batch_1,rewire_singapore_172,"because only the devils and Satan and the jinn kaffirr who bring mudharot fear and avoid newspapers.  
those who are able to memorize the holy book are definitely sholeh/a humans who are useful for the khilafa of the hereafter world. it is not in vain if they are sent to school, they can bring peace and kehilafahan in the land of kaffirr school goals.  
  
rambutan lilamin."
173,1582861162,fizf1zl,t3_fana0e,t3_fana0e,TELASO,eruukira,2020-02-28,"[('malay', 1.0), ('indonesian', 0.9638013834603268), ('english', 0.8841108085156227)]",True,['telaso'],['indonesian'],True,batch_1,rewire_singapore_173,TELASO
174,1644657891,hwmj6rs,t3_sqku7l,t1_hwmg6fp,Ada juga yang namanya peler kambing (makanan yang sama mungkin cuma beda nama).,GraffVonSpee,2022-02-12,"[('malay', 1.0), ('indonesian', 0.9869296468618646), ('english', 0.6434468053944701)]",True,['Peler'],['Indonesian'],True,batch_1,rewire_singapore_174,"There's also something called goat's peler (the same food, maybe just a different name)."
175,1625243361,h3tlmgt,t3_ocbvrk,t3_ocbvrk,Jadi pelacur dato2..senang la dpt cable,Lubtaihohoi,2021-07-02,"[('indonesian', 1.0), ('malay', 0.957736860350791), ('english', 0.8347692071993876)]",True,['pelacur'],['Indonesian'],True,batch_1,rewire_singapore_175,So dato2 slut..happy la dpt cable
176,1651861055,i7l1jha,t3_ujnvpu,t1_i7khgf2,TIL malay pantat,yogafire629,2022-05-06,"[('malay', 1.0), ('indonesian', 0.9601690239388416), ('english', 0.9563253860895051)]",True,['pantat'],['Indonesian'],True,batch_1,rewire_singapore_176,TIL malay ass
177,1559900353,eq9cuzr,t3_bxr6kf,t3_bxr6kf,Tu namanya Jaguar betina,larilagilaju,2019-06-07,"[('indonesian', 1.0), ('malay', 0.9932494377284952), ('english', 0.8046285645430337)]",True,['Betina'],['Malay'],True,batch_1,rewire_singapore_177,Tu's name is Jaguar female
178,1635214178,hi2cmfn,t3_qfpx62,t3_qfpx62,"Phobia ulat, segala bentuk ulat dari yg berbulu atau nggak, sampai yg bukan jenis ulat tapi mirip, kayak maggot, geli merinding semua, bentuknya ga jelas jijik jancuk, ga sengaja liat di tv atau youtube aja pasti langsung ganti channel. 

Pernah lari keliling sekolah pas SMP gara2 dikejar temen bawa ulat di daun, masuk kantin ambil parang yg buat motong es itu terus kutodongin balik sampe dipisahin guru, sebenernya dalam rangka lucu2an sih, jadi ga ada yg dihukum.

Mending ketemu ular, meskipun sama2 jalannya slither (apaan cuk lupa bhs indo nya), tapi mukanya jelas, bentuknya jelas, ga bikin jijik, pernah ketemu juga biasa wae reaksinya, tp kalau ulat bener2 gabisa.",Retardia,2021-10-26,"[('indonesian', 1.0), ('malay', 0.9622268851464382), ('english', 0.6609110784610085)]",True,['jancuk'],['Indonesian'],True,batch_1,rewire_singapore_178,"Caterpillar phobia, all forms of caterpillars from hairy or not, to those that are not types of caterpillars but are similar, like maggots, ticklish goosebumps all over, the shape is unclear disgusting, accidentally seeing it on TV or YouTube must immediately change the channel.

Once ran around the school in junior high school because of being chased by a friend carrying a caterpillar on a leaf, entered the canteen to take the machete that was used to cut the ice and then I pointed it back until the teacher separated it, actually in order to be funny anyway, so no one was punished.

It's better to meet a snake, even though the same path is slither (fuck cuk forgot his indo bhs), but the face is clear, the shape is clear, it doesn't make you disgusted, once you meet it, the reaction is normal, but if the caterpillar really can't."
179,1651398582,i6w0msd,t3_ufe3o0,t3_ufe3o0,wah sohai,Relative_Position147,2022-05-01,"[('malay', 1.0), ('indonesian', 0.85848517327617), ('english', 0.8235522252366658)]",True,['Sohai'],['Malay'],True,batch_1,rewire_singapore_179,wah sohai
180,1509433738,dp4t9jy,t3_79tte1,t3_79tte1,Datuk hantam burit!,ButuhKuda,2017-10-31,"[('malay', 1.0), ('indonesian', 0.9477115732332647), ('english', 0.797098553744786)]",True,['burit'],['indonesian'],True,batch_1,rewire_singapore_180,Grandpa hit the stern!
181,1516407265,dsy2xd5,t3_7riccs,t3_7riccs,Sohai benda camni pun nak periksa. Smh.,just_another_jabroni,2018-01-20,"[('malay', 1.0), ('indonesian', 0.9758409940687559), ('english', 0.8266547783710757)]",True,['Sohai'],['Malay'],True,batch_1,rewire_singapore_181,Sohai thing camni pun nak check. Smh.
182,1574228901,f8431fd,t3_dynoqg,t1_f83w52p,anjrot botnya anti aseng wkwkwk..,wiyawiyayo,2019-11-20,"[('indonesian', 1.0), ('malay', 0.9509725710952792), ('english', 0.8444070354475396)]",True,['Anjrot'],['Indonesian'],True,batch_1,rewire_singapore_182,Anjrot bot is anti-engineering ...
183,1572594478,f5zy2wx,t3_dpqynx,t1_f5zxyst,memang ilmu internet psikologi saking hebatnya tidak bisa dijelaskan. Namanya juga modal bacot dan sok tau doang,han_finh,2019-11-01,"[('indonesian', 1.0), ('malay', 0.9483807003325685), ('english', 0.6539014361709246)]",True,['bacot'],['Indonesian'],True,batch_1,rewire_singapore_183,"Indeed, the science of internet psychology is so great that it cannot be explained. His name is also a capital of talk and pretend to know doang"
184,1654547884,ibeqrhr,t3_v671tr,t1_ibdzumf,"paling gak bisa mem-filter :D

yang norak keliatan kalo okb",xsanisty,2022-06-06,"[('indonesian', 1.0), ('malay', 0.920477277188326), ('english', 0.7790903038370945)]",True,['norak'],['Indonesian'],True,batch_1,rewire_singapore_184,"at least it can filter :D

the tacky one looks okb"
185,1661924729,imhl0i8,t3_x1oz4g,t1_imhknc6,meki nya 3-star michelin,collectivekicks,2022-08-31,"[('indonesian', 1.0), ('malay', 0.9924213941443589), ('english', 0.9444779466950588)]",True,['Meki'],['Indonesian'],True,batch_1,rewire_singapore_185,its meki 3-star michelin
186,1566652305,exyhpuv,t3_cugtpr,t1_exy4v7y,"Dulu aku pernah beli HP baru, tapi berhubung budget mepet, ga langsung beli casing sama tempered glass.

Besoknya aku mau ke K\*rtika buat beli TG sama casing, di depan toko gw ditelpon pacar, tapi hpnya jatuh... And then layarnya gores.

Belum beli TG udah cacat layarnya, mana di depan toko aksesoris HP pula 😭

Saranku: Buy protections for your phone after you purchase it **immediately.**",Choppedcity,2019-08-24,"[('indonesian', 1.0), ('malay', 0.9488761970970762), ('english', 0.8082332098854059)]",True,['cacat'],['Indonesian'],True,batch_1,rewire_singapore_186,"I used to buy a new cellphone, but since the budget was tight, I didn't immediately buy a case and tempered glass.

The next day I went to K\*rtika to buy TG and case, in front of the store I got a call from my boyfriend, but the phone fell... And then the screen was scratched.

Haven't bought the TG yet, the screen is already defective, in front of the cellphone accessories shop anyway 😭

My advice: Buy protections for your phone after you purchase it **immediately.**"
187,1591857684,fto6bwq,t3_h0qgx5,t3_h0qgx5,"Lol ga boleh ""jelekin"" negeri sendiri? Padahal cuma kritik, kalau ga dikritik gimana bisa perbaiki diri 🤣 emang udah sinting ini negara",RegretfullyAgree,2020-06-11,"[('indonesian', 1.0), ('malay', 0.9826938768963658), ('english', 0.6032189662535274)]",True,['sinting'],['Indonesian'],True,batch_1,rewire_singapore_187,"Lol can't ""ugly"" your own country? Even though it's just criticism, if you don't criticize how can you improve yourself 🤣 how crazy is this country?"
188,1616986790,gsnckio,t3_mffknw,t3_mffknw,"Lion Air : udah untung lu bisa naik pesawat murah, gk usah banyak bacot dah .",Jaka45,2021-03-29,"[('indonesian', 1.0), ('malay', 0.9684978508701789), ('english', 0.6703094871235578)]",True,['bacot'],['Indonesian'],True,batch_1,rewire_singapore_188,"Lion Air: already lucky you can ride a cheap plane, don't need to talk much dah."
189,1632691391,heea88z,t3_pvs5y9,t3_pvs5y9,Dungu educate diri sendiri,Phara-Oh,2021-09-26,"[('indonesian', 1.0), ('malay', 0.9945051947768568), ('english', 0.905460860913489)]",True,['dungu'],['Indonesian'],True,batch_1,rewire_singapore_189,Dungu educate diri sendiri
190,1489448864,dew5fhg,t3_5z636j,t3_5z636j,Bacot mu nis. Lo aja deketin cendana sama FPI.,Trashcanbin13,2017-03-13,"[('indonesian', 1.0), ('malay', 0.9217264138573976), ('english', 0.8795139149868418)]",True,['bacot'],['Indonesian'],True,batch_1,rewire_singapore_190,You're talking nis. You just approached Sandalwood and FPI.
191,1656489081,ie5sft3,t3_vmsl9w,t3_vmsl9w,Ga makeupan sehari langsung dibilang pucet zzzz ngehe,callst,2022-06-29,"[('malay', 1.0), ('indonesian', 0.9977355144744705), ('english', 0.8073417535192948)]",True,['ngehe'],['Indonesian'],True,batch_1,rewire_singapore_191,Don't make up for a day and you'll say you're pale zzzz ngehe
192,1577587482,fcbj5bm,t3_egtjua,t1_fcbe1gx,bikin sendiri sana sama si kopet,irfanburningowl,2019-12-29,"[('indonesian', 1.0), ('malay', 0.9946362851968243), ('english', 0.7721675008771695)]",True,['kopet'],['Indonesian'],True,batch_1,rewire_singapore_192,Make it yourself with the kopet
193,1630589064,hbba56o,t3_pgat1z,t3_pgat1z,Miris kok bisa asn mental nya brengsek gitu ya,heitler,2021-09-02,"[('indonesian', 1.0), ('malay', 0.8795336504263259), ('english', 0.7377073381444533)]",True,['brengsek'],['Indonesian'],True,batch_1,rewire_singapore_193,It's sad how can asn mentally be such an asshole?
194,1633543522,hfmr39o,t3_q2hykw,t3_q2hykw,Nasi+telur+kicap,adambinaf,2021-10-06,"[('indonesian', 1.0), ('malay', 0.9834632876082231), ('english', 0.7213290188709361)]",True,['kicap'],['Malay'],True,batch_1,rewire_singapore_194,Rice+egg+kicap
195,1617709215,gtk4col,t3_ml2to1,t1_gtjyivi,"&gt;Anjrot lah salah dikit semua kebaikan dan sifat positif dilupain semua wkwkwkwk

Karena nila setitik rusak susu sebelangga",DjayRX,2021-04-06,"[('indonesian', 1.0), ('malay', 0.981186825490623), ('english', 0.6185538105601631)]",True,['Anjrot'],['Indonesian'],True,batch_1,rewire_singapore_195,"""Damn it, it's wrong, all the goodness and positive traits are forgotten.

Because a speck of indigo spoils the neighbor's milk"
196,1649824843,i4izo13,t3_u1yijg,t1_i4iz6ne,"tetep.. Lha wong uda rumah, bukan sewa lagi.

maintain good relationships with the rest of residents juga.

syukurlah beda lantai ama si kampret.

ini tuh salah satu efek banyak pekerja indo yg nyambi jadi PSK.... semua yg indo kena dampaknya.... kekampretan yg hakiki emang",hamsterdeed,2022-04-13,"[('indonesian', 1.0), ('malay', 0.9644610223681903), ('english', 0.7228396742056086)]",True,['kampret'],['Indonesian'],True,batch_1,rewire_singapore_196,"Still... It's a house, not a rental anymore.

maintain good relationships with the rest of the residents too.

Thank goodness for the different floors.

this is one of the effects of many indo workers who are also prostitutes.... all indo are affected.... the true emptiness of emang"
197,1661576130,ilyrvaa,t3_wyei23,t1_ilykkoy,Emang perlu disiram tinja sih rumah tetangganya,tukang_komentar,2022-08-27,"[('indonesian', 1.0), ('malay', 0.9994289456483397), ('english', 0.5924542580446853)]",True,['tinja'],['Malay'],True,batch_1,rewire_singapore_197,Do you really need to flush the neighbor's house with feces?
198,1632755995,hehbe9i,t3_ptz07t,t1_he2nui0,"even gue yang punya macbook, iphone, plus hackintosh (karena kepo aja ama kerumitannya, seru aja nyiksa kepala installnya) merasa ga terlalu banyak kepake hal hal yang ekosistemnya banget (macem airdrop, continuity itu segala macem) jadi ya biasa aja sih. serasa pake hape lptop dan desktop yang kebetulan os nya satu perusahaan aja.

Yang penting baterainya awet banget, appnya lebih enak (di iOS, mac sih rada dongo utility kecil dibanding windows, terutama offline music player!) sama mungkin agak aneh sih… spare partnya banyak! udah kayak thinkpad aja hahaha walau benerinnya ruwet bgt of course. Jadi ya… gitu deh",AganArya007,2021-09-27,"[('indonesian', 1.0), ('malay', 0.9524885142542577), ('english', 0.8277931890851329)]",True,['dongo'],['indonesian'],True,batch_1,rewire_singapore_198,"even I who have a macbook, iphone, plus hackintosh (because I'm curious about the complexity, it's just fun to torture my head to install it) feel that I don't use too many things that are really ecosystem things (like airdrop, continuity, all kinds of things) so it's just normal. it feels like using a laptop and desktop that just happens to be one company's os.

The important thing is that the battery lasts really long, the app is better (on iOS, macs are a little dongo utility compared to windows, especially offline music players!) and maybe it's a bit strange ... there are many spare parts! It's like a thinkpad hahaha even though it's really complicated to fix of course. So yeah... that's it"
199,1595824163,fzdg91e,t3_hyb147,t1_fzcuw41,Klo rumah deket danau kayak di Bratan Buyan auto 10° terutama saat musim hujan.,Xmarath,2020-07-27,"[('indonesian', 1.0), ('malay', 0.945274095998436), ('english', 0.7246606377703368)]",True,['Buyan'],['Indonesian'],True,batch_1,rewire_singapore_199,"If the house is near a lake like in Bratan Buyan, the auto 10° especially during the rainy season."
200,1617009197,gso41i4,t3_mfgohd,t3_mfgohd,"Gue pakai cuma buat praktikum SSI forum sebelah, sekali doang bulan lalu.

Di luar itu nggak tertarik sama liquid love atau nyari perek",fric_lair,2021-03-29,"[('indonesian', 1.0), ('malay', 0.9854814255458476), ('english', 0.6141142253026266)]",True,['perek'],['Indonesian'],True,batch_1,rewire_singapore_200,"I only used it for the SSI practicum in the next forum, once last month.

Outside of that, I'm not interested in liquid love or looking for a recorder."
201,1660367665,ik3ebzv,t3_wn4gqf,t3_wn4gqf,KANJUT BADAG,The_Student_Official,2022-08-13,"[('indonesian', 1.0), ('malay', 0.9496882425599363), ('english', 0.7112766043211867)]",True,['kanjut'],['indonesian'],True,batch_1,rewire_singapore_201,KANJUT BADAG
202,1618818448,gv23u3r,t3_mtswc8,t1_gv22mkv,"Jika bapak hitler masih bisa bersenggama dengan satu peler, kenapa saya tidak bisa coli pake Jav NTR housewife ? /s",Prabowo_Setiawan,2021-04-19,"[('indonesian', 1.0), ('malay', 0.9716134590761221), ('english', 0.7657569563329392)]",True,['Peler'],['Indonesian'],True,batch_1,rewire_singapore_202,"If Mr. Hitler can still have sex with one cock, why can't I have sex with Jav NTR housewife? /s"
203,1605285442,gc5ykrh,t3_jsyajo,t1_gc5hszd,"wahh mba fhp udah lama tak bersua eh ada kabar duka. turut berduka ya mba fhp dan mas kopet, semoga diberi ketabahan untuk keluarganya mas kopet.",RahwanaPutih,2020-11-13,"[('malay', 1.0), ('indonesian', 0.9878110006218587), ('english', 0.666278649160343)]",True,['kopet'],['Indonesian'],True,batch_1,rewire_singapore_203,"wahh mba fhp hasn't met for a long time eh there is sad news. sorry for mba fhp and mas kopet, hopefully given fortitude to his family mas kopet."
204,1648565743,i2kklfc,t3_tqxzgq,t3_tqxzgq,BENGAL BUYAN,Nagi828,2022-03-29,"[('indonesian', 1.0), ('malay', 0.9620694298723957), ('english', 0.8598998481585922)]",True,['Buyan'],['Indonesian'],True,batch_1,rewire_singapore_204,BENGAL BUYAN
205,1507185755,dnxlyf7,t3_74d5fg,t1_dnxklnf,"Tapi klo di komik Asterix, mereka makannya celeng terus.",jaxkjaxk,2017-10-05,"[('malay', 1.0), ('indonesian', 0.9815499645336336), ('english', 0.6548024518774147)]",True,['celeng'],['Indonesian'],True,batch_1,rewire_singapore_205,"But in Asterix comics, they eat pigs all the time."
206,1658993863,ihyoyem,t3_w9kmoh,t1_ihxmfoc,jambu apa tuh?,vecalen,2022-07-28,"[('malay', 1.0), ('indonesian', 0.9926146799566564), ('english', 0.7133893755454174)]",True,['jambu'],['indonesian'],True,batch_1,rewire_singapore_206,What kind of guava?
207,1566613257,exw5s9q,t3_cuks46,t1_exw1ro7,Kalo liat orang indo yg otak udang nanti diliatin. Kl ada scene nanti direkamin,saintfalcon,2019-08-24,"[('indonesian', 1.0), ('malay', 0.9444936612678068), ('english', 0.9413666904303837)]",True,['otak udang'],['indonesian'],True,batch_1,rewire_singapore_207,"If you see indo people with shrimp brains, you will see them. If there is a scene, it will be recorded"
