,created_utc,id,link_id,parent_id,body,author,date,lang_score,in_scope,terms,termlangs,useful,batch,rewire_id,trans_deepl
0,1654921115,ibxulbd,t3_v9lue7,t1_ibxsear,pepek,Kaermorhen666,2022-06-11,"[('malay', 1.0), ('indonesian', 0.9298952837299452), ('english', 0.640019083615882)]",True,['pepek'],['Indonesian'],True,batch_1,rewire_singapore_0,pepek
1,1591583920,ftbx3lo,t3_gygmy6,t1_ftbwq05,"aku punya foto di kosan dulu banget lagi buat mie tanpa baju badanku kurus ceking sambil jongkok dan nyengir ke kamera skrg udah kerja di BUMN udah gemuk kadang sedih liat fotonya hehe

semangat man",internweb,2020-06-08,"[('malay', 1.0), ('indonesian', 0.9720611689238604), ('english', 0.6650450210128201)]",True,['ceking'],['Indonesian'],True,batch_1,rewire_singapore_1,"I have a photo in the boarding house, I used to make noodles without clothes, my body was skinny while squatting and grinning at the camera, now I work in BUMN, I'm already fat, sometimes I'm sad to see the photo hehe

spirit man"
2,1636376976,hjssdd5,t3_qpb4hc,t3_qpb4hc,lah emang sebelumnya g dicek dulu nama goto punya siapa ? belegug bener. Semoga si pengugat menang.,peminum_berat,2021-11-08,"[('indonesian', 1.0), ('malay', 0.9472613409663669), ('english', 0.6276919012556048)]",True,['belegug'],['Indonesian'],True,batch_1,rewire_singapore_2,Didn't you check whose name the goto was before? That's right. Hopefully the plaintiff wins.
3,1652247771,i85fnv2,t3_umq1pe,t1_i85ecz7,"Wc indomaret mana ada sih yg nyaman comfy gitu, gw yg pipis berdiri aja mesti geli2 jiji apalagi berak. Mendelep masuk lagi yg ad",Flyer888,2022-05-11,"[('indonesian', 1.0), ('malay', 0.9928393165848826), ('english', 0.7528444554428222)]",True,['berak'],['Indonesian'],True,batch_1,rewire_singapore_3,"Wc indomaret where there is a comfortable comfy so, I who pee standing must be ticklish jiji let alone defecate. Dumping in again that is"
4,1635898211,hj2zh21,t3_qky4ns,t1_hj083fe,"pendidikan indo: ""hush, jangan kurang ajar sama orang yang lebih tua, mereka harus dimuliakan.""

/s",avocado_law,2021-11-03,"[('malay', 1.0), ('indonesian', 0.9941409675323957), ('english', 0.5711346825864797)]",True,['kurang ajar'],['indonesian'],True,batch_1,rewire_singapore_4,"indo education: ""hush, don't be rude to your elders, they should be honored.""

/s"
5,1590518353,frwb17b,t3_gqwoen,t3_gqwoen,Yg salah tukang bajigur. Udah keruh masih aja diaduk2,friyatnaesa,2020-05-26,"[('malay', 1.0), ('indonesian', 0.9972807851272821), ('english', 0.653250685946111)]",True,['bajigur'],['Indonesian'],True,batch_1,rewire_singapore_5,What's wrong is the bajigur maker. It's already cloudy and still stirring
6,1629823362,ha6hx6a,t3_pail2o,t1_ha631bo,"bakmi pake daging babi merah kali itu, standar lah kalo dipusat kota kalo itu",beguganjang,2021-08-24,"[('indonesian', 1.0), ('malay', 0.9216366930463139), ('english', 0.7691947275113457)]",True,['babi'],['Indonesian'],True,batch_1,rewire_singapore_6,"noodles using red pork that time, standard lah if in the city center if it is"
7,1591542001,ft9u9z3,t3_gxvco8,t3_gxvco8,"Setelah baca thread yang soal uneg - uneg kaum kiri progressif, baru nyadar ternyata gerakan yang memperjuangkan inklusivitas ternyata dalam aksinya seringkali bersifat eksklusif. Jadi inget anekdot ini, lupa siapa yang bilang ""kalau kamu ga kiri, kamu gapunya hati. Kalau kamu ga kanan, kamu gapunya otak""",candrawijayatara,2020-06-07,"[('indonesian', 1.0), ('malay', 0.9972002135494519), ('english', 0.7089288149706058)]",True,['gapunya otak'],['indonesian'],True,batch_1,rewire_singapore_7,"After reading the thread about the uneg - uneg of the progressive left, I just realized that the movement that fights for inclusiveness is often exclusive in its actions. So I remember this anecdote, forgetting who said ""if you're not left, you don't have a heart. If you're not right, you don't have a brain"""
8,1566889369,ey7m7y9,t3_cvz01o,t1_ey7jm23,belom ada IBO kan?,gundam_zabaniyah,2019-08-27,"[('indonesian', 1.0), ('malay', 0.9549333586098718), ('english', 0.8347231576809176)]",True,['ibo'],['indonesian'],True,batch_1,rewire_singapore_8,"There is no IBO yet, right?"
9,1586090254,fmhqc1q,t3_fv6wbt,t1_fmhni6k,makanya *anak bengak* jangan dibuat jadi walkot,__Blackrobe__,2020-04-05,"[('indonesian', 1.0), ('malay', 0.9268428828485441), ('english', 0.6460225679598716)]",True,['bengak'],['Indonesian'],True,batch_1,rewire_singapore_9,that's why *anak bengak* should not be made into a walkot
10,1632321039,hdujk3d,t3_psn2ox,t3_psn2ox,Pengen ganti hape dari pixel 3 xl karena baterenya udah parah ( sot 4 jam) dan bluetooth udah gk bener putus2 kalo pake tws. Ada rekomendasi kah? So far sih performa masih bagus sebenernya kesel sama batere dan bluetooth aja,Goodshunter_,2021-09-22,"[('indonesian', 1.0), ('malay', 0.9494838743746798), ('english', 0.7839304127070884)]",True,['sot'],['Malay'],True,batch_1,rewire_singapore_10,"I want to change my phone from pixel 3 xl because the battery is already bad (sot 4 hours) and bluetooth is not really broken when using tws. Any recommendation? So far, the performance is still good, but the battery and bluetooth are still bad."
11,1639463797,hohdjij,t3_rfkgxp,t1_hoh9fao,"Komodo artinya anak-anak dari bahasa jepang. Komodo dragons berarti anak-anak naga. karena kaya naga ,,, tapi bantet. 

Source : biografi Alfred Wallace",wongsolemu,2021-12-14,"[('indonesian', 1.0), ('malay', 0.9357171811116621), ('english', 0.8210654032817194)]",True,['bantet'],['Indonesian'],True,batch_1,rewire_singapore_11,"Komodo means children from Japanese. Komodo dragons means children of dragons. Because they are rich in dragons... but bantet.

Source : biography of Alfred Wallace"
12,1627440366,h6sa8dt,t3_osqusp,t1_h6s7vob,"Berterimakasihlah kepada Hiroshimoot dan janny-janny pe'a

Beberapa board yang ngebut malah nggak ada capcaynya (kayak /pw/)",fric_lair,2021-07-28,"[('malay', 1.0), ('indonesian', 0.9586356521884973), ('english', 0.7556471486062257)]",True,"[""pe'a""]",['Indonesian'],True,batch_1,rewire_singapore_12,"Thanks to Hiroshimoot and janny-janny pe'a

Some speeding boards don't even have capcay (like /pw/)"
13,1613737954,go006l2,t3_k3b4as,t3_k3b4as,"Formulir pendaftaran vaksin lansia pake google form. Pemerintah goblok.

https://kumparan.com/pandangan-jogja/ini-formulir-pendaftaran-vaksinasi-lansia-area-jawa-bali-yang-dijamin-asli-1vCtW8xloTQ",rumraisinisgood,2021-02-19,"[('indonesian', 1.0), ('malay', 0.9360937598878512), ('english', 0.7849139188629871)]",True,['goblok'],['Indonesian'],True,batch_1,rewire_singapore_13,"Elderly vaccine enrollment form using google form. The government is stupid.

https://kumparan.com/pandangan-jogja/ini-formulir-pendaftaran-vaksinasi-lansia-area-jawa-bali-yang-dijamin-asli-1vCtW8xloTQ"
14,1619350916,gvt4x8q,t3_mxu23o,t1_gvt3tho,Wah Lau don’t Suan my yong tau fu leh,PmMeYourNoobz,2021-04-25,"[('malay', 1.0), ('indonesian', 0.9708346040092607), ('english', 0.8678219786175615)]",True,['wah lau'],['Singlish'],True,batch_1,rewire_singapore_14,Wah Lau don't Suan my yong tau fu leh
15,1611109225,gjwgiqj,t3_l0o24z,t1_gjw7nma,Ini yakin ketombe gak? Bisa aja ini dry scalp atau malah jangan jangan tinea capitis (kurap kepala).,TaiwanNambaWanKenobi,2021-01-20,"[('indonesian', 1.0), ('malay', 0.9295660003047564), ('english', 0.7995285170738494)]",True,['kurap'],['Indonesian'],True,batch_1,rewire_singapore_15,Are you sure it's dandruff? It could be dry scalp or even tinea capitis (ringworm of the head).
16,1614836178,gpmh1h3,t3_lwzbp7,t1_gpm1jxd,"Semangat juga fellow anak perempuan pertama :) memang susah memberi alasan ke orang-orang ini kenapa belum nikah, padahal memang nikah butuh banyak persiapan dr diri sendiri dan pasangan. I hope we can be successful enough to shut those people and one day can settle down with the people we love :)",ilovesushiandmochi,2021-03-04,"[('malay', 1.0), ('indonesian', 0.9887435051979334), ('english', 0.906043346185302)]",True,['butuh'],['Malay'],True,batch_1,rewire_singapore_16,"The spirit of the first fellow daughter :) it's hard to give reasons to these people why they haven't married yet, even though marriage requires a lot of preparation from yourself and your partner. I hope we can be successful enough to shut those people and one day can settle down with the people we love :)"
17,1601114021,g6njty5,t3_j01xfn,t1_g6naxz7,"kalo dari sepengalaman gue, misalnya orang pake minta2 foto di awal tuh nanti malah dikira ga serius dan akhirnya si jablay itu bakal share info dan nomor kita di akun nya

ya gue lumayan sering liat akun gituan ngedoxx gitu",white_kucing,2020-09-26,"[('indonesian', 1.0), ('malay', 0.9299117698729696), ('english', 0.6852113254959861)]",True,['jablay'],['Indonesian'],True,batch_1,rewire_singapore_17,"from my experience, for example, if people ask for photos at the beginning, they will be thought to be not serious and finally the jablay will share our info and number on his account.

yes I quite often see that kind of account ngedoxx."
18,1636812146,hkgh6u2,t3_qsfplf,t1_hkg98m6,"Selamat datang di Lonte Mart, selamat berbelanja",dhaninugraha,2021-11-13,"[('malay', 1.0), ('indonesian', 0.9967095624227775), ('english', 0.673915653520417)]",True,['Lonte'],['Indonesian'],True,batch_1,rewire_singapore_18,"Welcome to Lonte Mart, happy shopping"
19,1626097041,h4x33wg,t3_oinz43,t1_h4x1tsv,dgn pondan,SnooSeagulls5353,2021-07-12,"[('indonesian', 1.0), ('malay', 0.8740876676388908), ('english', 0.8024714293035413)]",True,['pondan'],['Malay'],True,batch_1,rewire_singapore_19,dgn pondan
20,1631849172,hd5yg2b,t3_pp86sl,t1_hd2vm7o,"Gabisa, semua hal di penjara belinya lewat sipir, mulai dari air minum sampai jablay.",chucknorrium,2021-09-17,"[('indonesian', 1.0), ('malay', 0.9290579785682498), ('english', 0.6679335453533027)]",True,['jablay'],['Indonesian'],True,batch_1,rewire_singapore_20,"Gabisa, everything in prison is bought through the warden, from drinking water to jablay."
21,1650979781,i69hsyg,t3_ube3rl,t3_ube3rl,"Gua punya 1 Kakak laki laki dan 2 kakak perempuan. Gap antara ketiga kakak gua itu 1-3 tahun sementara gua 12 tahun dan gua anak terakhir. Ortu gua niatnya punya 3 anak doang tapi karena emak gua lupa minum pil kb akhirnya gua ada.

Hubungan kita kurang akrab terutama sama Abang gua. Kita sama sama pendiam jadi rasanya bener bener awkward meskipun kita berdua sama sama computer enthusiast. Gua jauh lebih akrab sama anak anak mereka, ketujuh ponakan gua.

Pernah sekali ketika ortu gua berkonflik, bapak gua yang lagi sedeng nganggap gua anak haram hasil selingkuhan. Dan juga kalo gua lagi frustrasi beras suka kepikiran kalo lebih baik jika gua gak pernah ada.",rissians,2022-04-26,"[('indonesian', 1.0), ('malay', 0.9823860456812993), ('english', 0.6446864175143888)]",True,"['anak haram', 'sedeng']",['Indonesian'],True,batch_1,rewire_singapore_21,"I have one brother and two sisters. The gap between my three older siblings is 1-3 years while I am 12 years old and I am the last child. My parents intended to have 3 children but because my mother forgot to take birth control pills, I ended up having one.

Our relationship is less intimate, especially with my brother. We are both quiet so it feels really awkward even though we are both computer enthusiasts. I'm much more familiar with their children, my seven nephews.

Once when my parents were in conflict, my father, who was in a mood, considered me an illegitimate child from an affair. And also if I'm frustrated, rice likes to think that it's better if I never existed."
22,1595253926,fynr5sr,t3_hu4exp,t3_hu4exp,"BUMN bangke lah, terutama Telkom. Setelah tahu istilah force majeure, sekarang jadi sering dipakai buat excuse. Dikit2 bilang force majore.",PerpetualInfinity,2020-07-20,"[('indonesian', 1.0), ('malay', 0.9640825722759466), ('english', 0.7732761873955469)]",True,['Bangke'],['Indonesian'],True,batch_1,rewire_singapore_22,"State-owned enterprises, especially Telkom. After knowing the term force majeure, it is now often used as an excuse. You say force majeure."
23,1593516333,fwgr553,t3_hi4gu1,t1_fwgqfsp,rektor sialan,mahastudent,2020-06-30,"[('malay', 1.0), ('indonesian', 0.9932778554643024), ('english', 0.7172755543254878)]",True,['sialan'],['Indonesian'],True,batch_1,rewire_singapore_23,damn chancellor
24,1433414938,crv6ctz,t3_38flx1,t1_cruucvv,Wah lau??,Asyrol,2015-06-04,"[('malay', 1.0), ('indonesian', 0.9751570531125071), ('english', 0.7777892806436346)]",True,['wah lau'],['Singlish'],True,batch_1,rewire_singapore_24,Whoa lau?
25,1643567088,huvs3ft,t3_sg4bca,t3_sg4bca,"Jadi inget 

Gw pernah pas pulang dari Pandeglang Banten


Liat supir truk nyetir sambil tidur mulutnya nganga

Sama sama bawa muatan berlebihan pula 

Tapi kayaknya selamat 

Ga ada berita kecelakaan soalnya",luthfins,2022-01-30,"[('indonesian', 1.0), ('malay', 0.9634715287323804), ('english', 0.6402309335901352)]",True,['nganga'],['indonesian'],True,batch_1,rewire_singapore_25,"So remember

I once returned from Pandeglang Banten


Seeing a truck driver driving while sleeping, his mouth dropped open.

Both carry excessive loads anyway

But it seems safe

There was no accident news"
26,1645189386,hxfvwac,t3_sutpbs,t3_sutpbs,monyet,bapack,2022-02-18,"[('indonesian', 1.0), ('malay', 0.9458568654613481), ('english', 0.8540195243457438)]",True,['monyet'],['Indonesian'],True,batch_1,rewire_singapore_26,monkey
27,1654164751,iaw8mxp,t3_v34k60,t1_iaw5czk,dianggap kuno palingan atau bahkan kampungan,error_269,2022-06-02,"[('indonesian', 1.0), ('malay', 0.9890520811597757), ('english', 0.5956499053682847)]",True,['Kampungan'],['Indonesian'],True,batch_1,rewire_singapore_27,considered old-fashioned or even plebeian
28,1613735201,gnzwqb8,t3_ln4xyq,t1_gnzq8kd,Ni lagi sekor bangang pergi share ig. Bodoh punya budak.,Vast_Ad_1093,2021-02-19,"[('indonesian', 1.0), ('malay', 0.987985327692971), ('english', 0.7352622867420637)]",True,['bangang'],['indonesian'],True,batch_1,rewire_singapore_28,Ni again sekor bangang go share ig. Fools have slaves.
29,1632568814,he7j1eq,t3_pv1w2q,t3_pv1w2q,"hukum mati aja,MUI paling betul,MUI nabii nnya  kebenaran,ente seairan dengan MUI?berarti ente juga bbisa jadi nabi",bahlul9,2021-09-25,"[('indonesian', 1.0), ('malay', 0.9334908730579132), ('english', 0.7461549550409526)]",True,['mati aja'],['Indonesian'],True,batch_1,rewire_singapore_29,"Just execute the law, MUI is the most correct, MUI is the prophet of truth, are you in agreement with MUI? Then you can also be a prophet."
30,1656906785,ies1utk,t3_vpmhnz,t1_ieqaabn,"Menurut gw kalau engga setuju karena alasan itu yasudah lah gpp asal jangan ada mindset ""lgbt harus dibunuh semua"" 😂


Sebenarnya tldr nya kaum lgbt cuma mau disamakan dengan manusia lain sih, cuma mau human rights aja. Sjw dan bule bule gila aja yang bikin orang lgbt keliatan gila dan sinting wkwkwk",PussyHunter1916,2022-07-04,"[('indonesian', 1.0), ('malay', 0.9846136838257125), ('english', 0.7020685643784603)]",True,['sinting'],['Indonesian'],True,batch_1,rewire_singapore_30,"I think if you don't agree for that reason, it's okay, just don't have the mindset of ""lgbt must be killed all"". 😂


Actually, lgbt people just want to be equal to other humans, they just want human rights. Sjw and crazy Caucasians just make lgbt people look crazy and crazy."
31,1637468188,hlgyunm,t3_qxx2rv,t1_hlg1xvg,"Belum pernah naik March atau Baleno baru jadi belum bisa komentar.

Rekomendasi city car ya? Baleno itu barunya 250 jutaan, jadi yang di bawah itu. 

Kalau bekas, saran saya ambil aja Jazz atau Yaris, Vios atau City. Mungkin minat Corolla atau Civic? Coba cari yang tahun 2014 ke bawah. LMPV bekas seperti Avanza, Ertiga, Mobilio juga bisa jadi pilihan, cukup irit kok. 

Kalau baru, coba aja dulu Baleno, Ignis, Brio juga bagus, mungkin Calya atau Sigra.",DeTomato_,2021-11-21,"[('indonesian', 1.0), ('malay', 0.9370055388145435), ('english', 0.7098305444053359)]",True,['vio'],['indonesian'],True,batch_1,rewire_singapore_31,"I haven't ridden the new March or Baleno yet so I can't comment.

What's your city car recommendation? The new Baleno is 250 million, so anything below that.

If it's used, my advice is to get a Jazz or Yaris, Vios or City. Maybe you're interested in a Corolla or Civic? Try looking for 2014 and below. Used LMPVs like Avanza, Ertiga, Mobilio can also be an option, they are quite economical.

If new, try Baleno, Ignis, Brio are also good, maybe Calya or Sigra."
32,1645835452,hygc0sh,t3_t18wkc,t1_hyesvhg,"Be my friend:

Nggak pernah ngerokok

Nggak pernah mabok

Tapi hobinya open BO dan ngewe sana-sini",ManggaBesar,2022-02-26,"[('indonesian', 1.0), ('malay', 0.9842755219184474), ('english', 0.8362126241323788)]",True,['ngewe'],['indonesian'],True,batch_1,rewire_singapore_32,"Be my friend:

Never smoked

Never get drunk

But his hobby is open BO and ngewe here and there"
33,1488850607,dellso3,t3_5xxhno,t3_5xxhno,"TRIBUNWOW.COM, JAKARTA - Gubernur DKI Jakarta, yang sekaligus Calon Gubernur DKI Jakarta (cagub) periode 2017-2022, Basuki Tjahaja Purnama atau Ahok, mendadak geram saat peresmian Taman Makam Mbah Priok, Jalan Pasar Koja, Kecamatan Koja, Jakarta Utara, berlangsung, Sabtu (4/3/2017).

Di lokasi peresmian, Ahok yang berkeinginan berpidato di depan seluruh warga dan pengelola, kaget saat tahu terdapat kesalahan fatal, pada isi Surat Keputusan (SK) peresmian lokasi bersejarah tersebut, menjadi Cagar Budaya.

Kesalahan fatal yang dimaksud dan membuat mantan Bupati Belitung Timur itu kesal, yakni pada bagian isi SK yang tertulis 'Diduga Cagar Budaya'.

Ahok mengklaim, di rapat pimpinan (rapim) beberapa waktu lalu, sudah terbahas agar kalimat tersebut diubah menjadi tertulis 'Dilindungi sebagai Cagar Budaya'.

""Wah enggak benar ini. Masa ada kata diduga lagi. Jebakan batman ini kayaknya. Kan sudah saya ubah kemarin kalau enggak ada lagi kata diduga. Wah, ini enggak benar ini,"" papar Ahok kesal sambil melotot ke rombongannya.

Menurut Ahok kata 'Diduga' tersebut, artinya atau bermakna tidak jelas.

Kemarahan Ahok pun akibat kesalahan fatal penulisan pada isi SK, juga turut membuat masyarakat, beserta para jemaah dan pengunjung Taman Makam Mbah Priok turut naik pitam.

Tak ayal, kekesalahan Ahok ini juga membuat seluruh warga dan pengelola bertanya-tanya akan kesalahan fatal terhadap isi SK tersebut.

""Cari pak orangnya yang sengaja mengubah SK itu. Matiin aja. Pecat saja pecat! Sejarah Islam kok jadi mainan sih. Kurang ajar itu pak Ahok!"" ungkapnya.

Kepala Dinas (Kadis) Pariwisata dan Budaya DKI Jakarta, Catur Laswanto, yang diketahui memegang dan memberikan SK yang belum terevisi tersebut, tidak bisa menyembunyikan rasa malunya.

Mencoba berdiri dari hadapan warga, pengelola, dan pengunjung di Taman Makam Mbah Priok, membuat Catur keringat dingin.

Nampak dari kejauhan, Catur mengangguk-anggukkan kepala sambil berbincang dengan Ahok yang saat itu wajahnya memerah marah.

Sambil memperlihatkan SK ke Catur, dan Ahok pun langsung kembali berucap ketus.

""Apa-apaan SK begini nih. Enggak benar kalau begini nih,"" ungkap marah Ahok sambil pukul dan sesekali menyentuh kertas SK tersebut, di hadapan Catur.

Emosi Ahok tak terbendung. Warga, pengelola sekaligus pengunjung pun nampak memerah panas, saat Catur hanya bisa menunduk serta menganggukkan kepalanya saat disemprot oleh Ahok.

Catur saat itu langsung bergegas meninggalkan lokasi dan kembali membawa tiga lembar kertas yamg diketahui SK yang asli.

Ahok pun geleng-geleng kepala dan semakin marah saat mengetahui SK peresmian Taman Makam Mbah Priok yang asli, masih disimpan rapih oleh Catur.

Seluruh warga yang hadir di lokasi peresmian pun semakin kaget bukan kepalang, ketika melihat Catur membawa SK yang asli.

""Nah itu (SK) yang asli. Kenapa yang dikasih pak Ahok SK yang belum direvisi? Mau jebak Pak Ahok ya pakai SK palsu?"" teriak seorang warga yang menyaksikan peresmian tersebut.

Ahok pun menyeletuk, ""Begitu ketahuan yang salah, keluar lah yang aslinya. Saya mau bilang kalimatnya dilindungi dan diberlakukan sebagia situs cagar budaya. Ini kurang ajar ini kalau masih pakai kata diduga-diduga begini,"" kata Ahok kesal.

Ahok, kemudian mencoret kertas SK Gubernur DKI yang fatal kesalahannya tersebut.

Sontak Ahok meminta pulpen dan mencorat-coret SK yang dinilai warga palsu tersebut.

""Mana pulpennya. Nih, saya coret yang salah,"" ucap Ahok kesal, lalu kembali duduk sambil menggerutu. (WartaKota/Panji baskhara Ramadhan)

",runeza43,2017-03-07,"[('indonesian', 1.0), ('malay', 0.9446426992576274), ('english', 0.6785767655479713)]",True,['kurang ajar'],['indonesian'],True,batch_1,rewire_singapore_33,"TRIBUNWOW.COM, JAKARTA - Jakarta Governor, who is also a candidate for the 2017-2022 period, Basuki Tjahaja Purnama or Ahok, was suddenly furious when the inauguration of Mbah Priok Cemetery, Jalan Pasar Koja, Koja District, North Jakarta, took place on Saturday (4/3/2017).

At the inauguration location, Ahok, who wanted to make a speech in front of all residents and managers, was shocked to find out that there was a fatal error, in the contents of the Decree (SK) inaugurating the historic location, becoming a Cultural Heritage.

The fatal mistake in question and made the former East Belitung Regent upset, namely in the contents of the decree which reads 'Suspected Cultural Heritage'.

Ahok claimed, at a leadership meeting (rapim) some time ago, it was discussed that the sentence should be changed to read 'Protected as Cultural Heritage'.

""Wow, this is not right. There is a word allegedly again. I think this is a batman's trap. I have changed it yesterday that there is no more word allegedly. Wow, this is not right,"" said Ahok irritably while glaring at his entourage.

According to Ahok, the word 'suspected' has an unclear meaning.

Ahok's anger was due to the fatal writing error in the contents of the decree, which also made the community, along with the congregation and visitors to the Mbah Priok Cemetery also angry.

No doubt, Ahok's mistake also made all residents and managers wonder about the fatal mistake in the content of the decree.

""Find the person who deliberately changed the decree. Just kill it. Just fire him! Islamic history is a toy anyway. That insolent Mr. Ahok!"" he said.

The Head of the DKI Jakarta Tourism and Culture Office (Kadis), Chess Laswanto, who is known to hold and provide the unrevised decree, cannot hide his embarrassment.

Trying to stand up from the presence of residents, managers, and visitors at Mbah Priok Cemetery, made Chess break out in a cold sweat.

Seen from a distance, Chess nodded his head while talking to Ahok, whose face was red with anger.

While showing the SK to Chess, and Ahok immediately returned to saying rudely.

""What the hell is this SK. This is not right,"" said Ahok angrily while hitting and occasionally touching the SK paper, in front of Chess.

Ahok's emotion was unstoppable. Residents, managers and visitors also seemed to be blushing hot, when Chess could only bow and nod his head when sprayed by Ahok.

Chess at that time immediately rushed to leave the location and returned with three sheets of paper known to be the original decree.

Ahok shook his head and became even angrier when he found out that the original decree of the inauguration of Mbah Priok Cemetery was still kept neatly by Chess.

All residents who attended the inauguration were even more shocked when they saw Chess carrying the original decree.

""Now that (SK) is the original. Why did Mr. Ahok give the SK that has not been revised? Do you want to trap Mr. Ahok using a fake SK?"" shouted a resident who witnessed the inauguration.

Ahok also quipped, ""Once the wrong one is discovered, the original one will come out. I want to say that the sentence is protected and enforced as a cultural heritage site. This is insolent if you still use the word allegedly like this,"" said Ahok irritably.

Ahok, then crossed out the paper of the DKI Governor Decree which was fatally wrong.

Suddenly Ahok asked for a pen and scribbled on the decree which was considered fake by the residents.

""Where is the pen. Here, I crossed out the wrong one,"" said Ahok annoyed, then returned to his seat while grumbling. (WartaKota/Panji baskhara Ramadhan)

"
34,1620730970,gxprgh1,t3_n9eixi,t1_gxpp81w,Lolok.0,FranklyNinja,2021-05-11,"[('indonesian', 1.0), ('malay', 0.8543523509633345), ('english', 0.6445482364309874)]",True,['lolok'],['Malay'],True,batch_1,rewire_singapore_34,Lolok.0
35,1614313833,gosmzs9,t3_lspb1w,t1_gosllbo,"bangsat fanfic apa ini, saya ke reddit tidak untuk melihat hal seperti ini",sheamor,2021-02-26,"[('malay', 1.0), ('indonesian', 0.9662068673751738), ('english', 0.6810912142004366)]",True,['bangsat'],['Indonesian'],True,batch_1,rewire_singapore_35,"What the fuck is this fanfic, I didn't come to reddit to see something like this."
